"DESCRIPTION","DURATION IN MS","NAME","PARENT SUITE","START TIME","STATUS","STOP TIME","SUB SUITE","SUITE","TEST CLASS","TEST METHOD"
"","4","Component Tests ConfirmDialog Escape key calls onCancel when not busy","","Mon Apr 20 17:49:36 UTC 2026","passed","Mon Apr 20 17:49:36 UTC 2026","","Component Tests","Component Tests ConfirmDialog Escape key calls onCancel when not busy",""
"","1","Utility Functions hslToRgb negative hue wraps: hue=-120 = hue=240","","Mon Apr 20 17:49:36 UTC 2026","passed","Mon Apr 20 17:49:36 UTC 2026","","Utility Functions","Utility Functions hslToRgb negative hue wraps: hue=-120 = hue=240",""
"","9","Server Integration Tests (Testcontainers) PUT /api/colors/:name should return 400 when update body is empty","","Mon Apr 20 17:51:43 UTC 2026","passed","Mon Apr 20 17:51:43 UTC 2026","","Server Integration Tests (Testcontainers)","Server Integration Tests (Testcontainers) PUT /api/colors/:name should return 400 when update body is empty",""
"","52","GET /api/colors/Red should return the correct hex code","Chrome","Mon Apr 20 18:17:06 UTC 2026","passed","Mon Apr 20 18:17:06 UTC 2026","Backend API Integration","","",""
"","5","Server Unit Tests POST /api/colors returns 400 for extra unknown fields (strict schema)","","Mon Apr 20 17:54:39 UTC 2026","passed","Mon Apr 20 17:54:39 UTC 2026","","Server Unit Tests","Server Unit Tests POST /api/colors returns 400 for extra unknown fields (strict schema)",""
"","41","Frontend Unit Tests App Component handleColorClick encodes color name in URL","","Mon Apr 20 17:49:36 UTC 2026","passed","Mon Apr 20 17:49:36 UTC 2026","","Frontend Unit Tests","Frontend Unit Tests App Component handleColorClick encodes color name in URL",""
"","1","Utility Functions hslToRgb lightness=1 gives white","","Mon Apr 20 17:49:36 UTC 2026","passed","Mon Apr 20 17:49:36 UTC 2026","","Utility Functions","Utility Functions hslToRgb lightness=1 gives white",""
"","771","Escape key closes the confirm dialog","Chrome","Mon Apr 20 18:17:23 UTC 2026","passed","Mon Apr 20 18:17:24 UTC 2026","Color Management — Add & Delete","tests/color-management.spec.ts","",""
"","51","Frontend Unit Tests App Component renders title, logo, and calls initial fetch","","Mon Apr 20 17:49:36 UTC 2026","passed","Mon Apr 20 17:49:36 UTC 2026","","Frontend Unit Tests","Frontend Unit Tests App Component renders title, logo, and calls initial fetch",""
"","26","Server Unit Tests POST /api/colors creates a new color and returns 201 with correct body","","Mon Apr 20 17:54:39 UTC 2026","passed","Mon Apr 20 17:54:39 UTC 2026","","Server Unit Tests","Server Unit Tests POST /api/colors creates a new color and returns 201 with correct body",""
"","8","Component Tests ConfirmDialog dialog has correct ARIA attributes","","Mon Apr 20 17:49:36 UTC 2026","passed","Mon Apr 20 17:49:36 UTC 2026","","Component Tests","Component Tests ConfirmDialog dialog has correct ARIA attributes",""
"","1347","shows 409 duplicate error from server inside the picker","Chrome","Mon Apr 20 18:17:20 UTC 2026","passed","Mon Apr 20 18:17:22 UTC 2026","Color Management — Add & Delete","tests/color-management.spec.ts","",""
"","24","Component Tests ColorPicker mousedown at right-center (hue=0) sets hex to #ff0000","","Mon Apr 20 17:49:36 UTC 2026","passed","Mon Apr 20 17:49:36 UTC 2026","","Utility Functions","Component Tests ColorPicker mousedown at right-center (hue=0) sets hex to #ff0000",""
"","893","verify Red ( #e74c3c ) is applied as the background color","Chrome","Mon Apr 20 18:06:01 UTC 2026","passed","Mon Apr 20 18:06:02 UTC 2026","POM Refactored: Background color tests","tests/pom-refactored.spec.ts","",""
"","29","Component Tests ConfirmDialog cancel button calls onCancel","","Mon Apr 20 17:49:36 UTC 2026","passed","Mon Apr 20 17:49:36 UTC 2026","","Component Tests","Component Tests ConfirmDialog cancel button calls onCancel",""
"","3","Server Unit Tests DELETE /api/colors/:name returns 400 for invalid name in path (regex check)","","Mon Apr 20 17:54:39 UTC 2026","passed","Mon Apr 20 17:54:39 UTC 2026","","Server Unit Tests","Server Unit Tests DELETE /api/colors/:name returns 400 for invalid name in path (regex check)",""
"","1094","DELETE /api/colors/{name}","","","passed","","","schemathesis","",""
"","1","Utility Functions hslToRgb hue=210 (azure) → [0,128,255]","","Mon Apr 20 17:49:36 UTC 2026","passed","Mon Apr 20 17:49:36 UTC 2026","","Utility Functions","Utility Functions hslToRgb hue=210 (azure) → [0,128,255]",""
"","1","Utility Functions rgbToHsl round-trip hslToRgb→rgbToHsl preserves hue for all sectors","","Mon Apr 20 17:49:36 UTC 2026","passed","Mon Apr 20 17:49:36 UTC 2026","","Utility Functions","Utility Functions rgbToHsl round-trip hslToRgb→rgbToHsl preserves hue for all sectors",""
"","2120","PUT /api/colors/{name}","","","passed","","","schemathesis","",""
"","5","Server Unit Tests Middleware returns 413 for payload too large","","Mon Apr 20 17:54:39 UTC 2026","passed","Mon Apr 20 17:54:39 UTC 2026","","Server Unit Tests","Server Unit Tests Middleware returns 413 for payload too large",""
"","10","Server Unit Tests PUT /api/colors/:name updates the hex of an existing color","","Mon Apr 20 17:54:39 UTC 2026","passed","Mon Apr 20 17:54:39 UTC 2026","","Server Unit Tests","Server Unit Tests PUT /api/colors/:name updates the hex of an existing color",""
"","4","Server Unit Tests Middleware includes CORS headers","","Mon Apr 20 17:54:39 UTC 2026","passed","Mon Apr 20 17:54:39 UTC 2026","","Server Unit Tests","Server Unit Tests Middleware includes CORS headers",""
"","0","Utility Functions rgbToHsl black [0,0,0] → h=0, s=0, l=0","","Mon Apr 20 17:49:36 UTC 2026","passed","Mon Apr 20 17:49:36 UTC 2026","","Utility Functions","Utility Functions rgbToHsl black [0,0,0] → h=0, s=0, l=0",""
"","5","Server Unit Tests PUT /api/colors/:name updates both name and hex simultaneously","","Mon Apr 20 17:54:39 UTC 2026","passed","Mon Apr 20 17:54:39 UTC 2026","","Server Unit Tests","Server Unit Tests PUT /api/colors/:name updates both name and hex simultaneously",""
"","38","Frontend Unit Tests App Component confirm dialog Escape key closes it","","Mon Apr 20 17:49:36 UTC 2026","passed","Mon Apr 20 17:49:36 UTC 2026","","Frontend Unit Tests","Frontend Unit Tests App Component confirm dialog Escape key closes it",""
"","1","Utility Functions hexToRgb is case-insensitive","","Mon Apr 20 17:49:36 UTC 2026","passed","Mon Apr 20 17:49:36 UTC 2026","","Utility Functions","Utility Functions hexToRgb is case-insensitive",""
"","617","verify language switcher changes document language","Chrome","Mon Apr 20 18:05:55 UTC 2026","passed","Mon Apr 20 18:05:56 UTC 2026","","tests/coverage.spec.ts","",""
"","1","Utility Functions rgbToHsl pure red → h=0, s=1, l=0.5","","Mon Apr 20 17:49:36 UTC 2026","passed","Mon Apr 20 17:49:36 UTC 2026","","Utility Functions","Utility Functions rgbToHsl pure red → h=0, s=1, l=0.5",""
"","6","DELETE /api/colors (collection) returns 405","Chrome","Mon Apr 20 18:12:35 UTC 2026","passed","Mon Apr 20 18:12:35 UTC 2026","Security > HTTP Method Restrictions","tests/security.spec.ts","",""
"","0","Utility Functions hslToRgb lightness clamped: l=1.5 gives white","","Mon Apr 20 17:49:36 UTC 2026","passed","Mon Apr 20 17:49:36 UTC 2026","","Utility Functions","Utility Functions hslToRgb lightness clamped: l=1.5 gives white",""
"","6","Server Unit Tests Surviving Mutants & Edge Cases Rate Limiting & Security kills mutants by verifying x-powered-by is removed","","Mon Apr 20 17:54:39 UTC 2026","passed","Mon Apr 20 17:54:39 UTC 2026","","Server Unit Tests","Server Unit Tests Surviving Mutants & Edge Cases Rate Limiting & Security kills mutants by verifying x-powered-by is removed",""
"","12","NoSQL $where operator in name is rejected (400)","Chrome","Mon Apr 20 18:12:35 UTC 2026","passed","Mon Apr 20 18:12:35 UTC 2026","Security > Injection Prevention","tests/security.spec.ts","",""
"","11","Server Integration Tests (Testcontainers) GET /api/colors/:name should return correct data for Yellow","","Mon Apr 20 17:51:43 UTC 2026","passed","Mon Apr 20 17:51:43 UTC 2026","","Server Integration Tests (Testcontainers)","Server Integration Tests (Testcontainers) GET /api/colors/:name should return correct data for Yellow",""
"","1595","should maintain accessibility in es language and verify resilient locators","Chrome","Mon Apr 20 18:11:32 UTC 2026","passed","Mon Apr 20 18:11:34 UTC 2026","i18n Accessibility Tests","tests/a11y.spec.ts","",""
"","0","Utility Functions hslToRgb lightness=0 gives black","","Mon Apr 20 17:49:36 UTC 2026","passed","Mon Apr 20 17:49:36 UTC 2026","","Utility Functions","Utility Functions hslToRgb lightness=0 gives black",""
"","44","Frontend Unit Tests App Component learn react link has correct text","","Mon Apr 20 17:49:36 UTC 2026","passed","Mon Apr 20 17:49:36 UTC 2026","","Frontend Unit Tests","Frontend Unit Tests App Component learn react link has correct text",""
"","995","Example #3","BDD","Mon Apr 20 18:17:12 UTC 2026","passed","Mon Apr 20 18:17:13 UTC 2026","Home Page Background Color > Change background color","","",""
"","80","should return 404 for non-existent color deletion","Chrome","Mon Apr 20 18:17:15 UTC 2026","passed","Mon Apr 20 18:17:16 UTC 2026","Backend API Integration > DELETE /api/colors/:name","tests/api.spec.ts","",""
"","5","Server Unit Tests POST /api/colors returns 400 for completely empty body","","Mon Apr 20 17:54:39 UTC 2026","passed","Mon Apr 20 17:54:39 UTC 2026","","Server Unit Tests","Server Unit Tests POST /api/colors returns 400 for completely empty body",""
"","21","Component Tests ColorPicker touchend stops dragging (touchmove after touchend is ignored)","","Mon Apr 20 17:49:36 UTC 2026","passed","Mon Apr 20 17:49:36 UTC 2026","","Utility Functions","Component Tests ColorPicker touchend stops dragging (touchmove after touchend is ignored)",""
"","36","Server Unit Tests GET /api/colors returns all seeded colors with correct names and hex values","","Mon Apr 20 17:54:39 UTC 2026","passed","Mon Apr 20 17:54:39 UTC 2026","","Server Unit Tests","Server Unit Tests GET /api/colors returns all seeded colors with correct names and hex values",""
"","38","Server Integration Tests (Testcontainers) POST /api/colors should create a new color and persist it in the real database","","Mon Apr 20 17:51:43 UTC 2026","passed","Mon Apr 20 17:51:43 UTC 2026","","Server Integration Tests (Testcontainers)","Server Integration Tests (Testcontainers) POST /api/colors should create a new color and persist it in the real database",""
"","0","Utility Functions hslToRgb hue=150 (spring green) → [0,255,128]","","Mon Apr 20 17:49:36 UTC 2026","passed","Mon Apr 20 17:49:36 UTC 2026","","Utility Functions","Utility Functions hslToRgb hue=150 (spring green) → [0,255,128]",""
"","10","Frontend Unit Tests i18n Configuration should translate keys correctly","","Mon Apr 20 17:49:38 UTC 2026","passed","Mon Apr 20 17:49:38 UTC 2026","","Frontend Unit Tests","Frontend Unit Tests i18n Configuration should translate keys correctly",""
"","13","Component Tests ColorPicker Add color button shows ""Saving…"" when saving=true","","Mon Apr 20 17:49:36 UTC 2026","passed","Mon Apr 20 17:49:36 UTC 2026","","Utility Functions","Component Tests ColorPicker Add color button shows ""Saving…"" when saving=true",""
"","115","Frontend Unit Tests App Component handleColorClick does nothing when data has no hex","","Mon Apr 20 17:49:36 UTC 2026","passed","Mon Apr 20 17:49:36 UTC 2026","","Frontend Unit Tests","Frontend Unit Tests App Component handleColorClick does nothing when data has no hex",""
"","1114","homepage should match snapshot","Chrome","Mon Apr 20 18:18:50 UTC 2026","passed","Mon Apr 20 18:18:51 UTC 2026","Visual Regression – desktop-xl (1920×1080)","","",""
"","22","GET /api/colors/Yellow should return the correct hex code","Chrome","Mon Apr 20 18:17:06 UTC 2026","passed","Mon Apr 20 18:17:06 UTC 2026","Backend API Integration","","",""
"","27","Frontend Unit Tests App Component clicking Add color button opens picker modal","","Mon Apr 20 17:49:36 UTC 2026","passed","Mon Apr 20 17:49:36 UTC 2026","","Frontend Unit Tests","Frontend Unit Tests App Component clicking Add color button opens picker modal",""
"","30","Frontend Unit Tests App Component labelFor returns translation for known color (Turquoise)","","Mon Apr 20 17:49:36 UTC 2026","passed","Mon Apr 20 17:49:36 UTC 2026","","Frontend Unit Tests","Frontend Unit Tests App Component labelFor returns translation for known color (Turquoise)",""
"","23","Component Tests ColorPicker mousedown at bottom-center (hue=90) sets hex to #80ff00","","Mon Apr 20 17:49:36 UTC 2026","passed","Mon Apr 20 17:49:36 UTC 2026","","Utility Functions","Component Tests ColorPicker mousedown at bottom-center (hue=90) sets hex to #80ff00",""
"","9","malformed JSON body returns 400","Chrome","Mon Apr 20 18:12:35 UTC 2026","passed","Mon Apr 20 18:12:35 UTC 2026","Security > Input Validation","tests/security.spec.ts","",""
"","0","Utility Functions hslToRgb hue=270 (violet) → [128,0,255]","","Mon Apr 20 17:49:36 UTC 2026","passed","Mon Apr 20 17:49:36 UTC 2026","","Utility Functions","Utility Functions hslToRgb hue=270 (violet) → [128,0,255]",""
"","8","Server Unit Tests Surviving Mutants & Edge Cases PUT logic kills name/hex conditional mutants by providing only one field","","Mon Apr 20 17:54:39 UTC 2026","passed","Mon Apr 20 17:54:39 UTC 2026","","Server Unit Tests","Server Unit Tests Surviving Mutants & Edge Cases PUT logic kills name/hex conditional mutants by providing only one field",""
"","2077","should load the application and verify core functionality across browsers","Firefox","Mon Apr 20 18:17:17 UTC 2026","passed","Mon Apr 20 18:17:19 UTC 2026","Cross-Browser Core Functionality","","",""
"","14","Server Integration Tests (Testcontainers) POST /api/colors should return 409 when creating a duplicate color name","","Mon Apr 20 17:51:43 UTC 2026","passed","Mon Apr 20 17:51:43 UTC 2026","","Server Integration Tests (Testcontainers)","Server Integration Tests (Testcontainers) POST /api/colors should return 409 when creating a duplicate color name",""
"","0","Utility Functions rgbToHsl r max with g<b (#ff0040) → h near 345","","Mon Apr 20 17:49:36 UTC 2026","passed","Mon Apr 20 17:49:36 UTC 2026","","Utility Functions","Utility Functions rgbToHsl r max with g<b (#ff0040) → h near 345",""
"","4","Server Unit Tests Surviving Mutants & Edge Cases PUT logic kills hex regex mutant in PUT","","Mon Apr 20 17:54:39 UTC 2026","passed","Mon Apr 20 17:54:39 UTC 2026","","Server Unit Tests","Server Unit Tests Surviving Mutants & Edge Cases PUT logic kills hex regex mutant in PUT",""
"","0","Utility Functions rgbToHex output is lowercase","","Mon Apr 20 17:49:36 UTC 2026","passed","Mon Apr 20 17:49:36 UTC 2026","","Utility Functions","Utility Functions rgbToHex output is lowercase",""
"","3","Server Unit Tests PUT /api/colors/:name returns 400 for invalid name in path (regex check)","","Mon Apr 20 17:54:39 UTC 2026","passed","Mon Apr 20 17:54:39 UTC 2026","","Server Unit Tests","Server Unit Tests PUT /api/colors/:name returns 400 for invalid name in path (regex check)",""
"","4","Server Unit Tests Surviving Mutants & Edge Cases Swagger JSDoc Integration kills apis array mutants by verifying JSDoc content is present","","Mon Apr 20 17:54:39 UTC 2026","passed","Mon Apr 20 17:54:39 UTC 2026","","Server Unit Tests","Server Unit Tests Surviving Mutants & Edge Cases Swagger JSDoc Integration kills apis array mutants by verifying JSDoc content is present",""
"","639","Example #1","BDD","Mon Apr 20 18:17:11 UTC 2026","passed","Mon Apr 20 18:17:12 UTC 2026","Home Page Background Color > Change background color","","",""
"","20","Frontend Unit Tests App Component text color on light background is dark","","Mon Apr 20 17:49:36 UTC 2026","passed","Mon Apr 20 17:49:36 UTC 2026","","Frontend Unit Tests","Frontend Unit Tests App Component text color on light background is dark",""
"","5","Server Unit Tests 405 Method Not Allowed does not return 405 for allowed PUT method on /api/colors/:name","","Mon Apr 20 17:54:39 UTC 2026","passed","Mon Apr 20 17:54:39 UTC 2026","","Server Unit Tests","Server Unit Tests 405 Method Not Allowed does not return 405 for allowed PUT method on /api/colors/:name",""
"","17","Server Integration Tests (Testcontainers) GET /api/colors/:name should return 400 for invalid name format","","Mon Apr 20 17:51:43 UTC 2026","passed","Mon Apr 20 17:51:43 UTC 2026","","Server Integration Tests (Testcontainers)","Server Integration Tests (Testcontainers) GET /api/colors/:name should return 400 for invalid name format",""
"","641","Background stays unchanged when fetching a specific color fails","BDD","Mon Apr 20 18:17:11 UTC 2026","passed","Mon Apr 20 18:17:12 UTC 2026","API Error Handling","","",""
"","11","Server Integration Tests (Testcontainers) seedDatabase should always restore the three default seed colors","","Mon Apr 20 17:51:43 UTC 2026","passed","Mon Apr 20 17:51:43 UTC 2026","","Server Integration Tests (Testcontainers)","Server Integration Tests (Testcontainers) seedDatabase should always restore the three default seed colors",""
"","657","check Turquoise ( #1abc9c) is the default background color.","Chrome","Mon Apr 20 18:17:26 UTC 2026","passed","Mon Apr 20 18:17:27 UTC 2026","","tests/coverage.spec.ts","",""
"","140","Component Tests ConfirmDialog renders title, body, and both buttons","","Mon Apr 20 17:49:36 UTC 2026","passed","Mon Apr 20 17:49:36 UTC 2026","","Component Tests","Component Tests ConfirmDialog renders title, body, and both buttons",""
"","6","Frontend Unit Tests App Component colors.length === 0 shows loading text","","Mon Apr 20 17:49:36 UTC 2026","passed","Mon Apr 20 17:49:36 UTC 2026","","Frontend Unit Tests","Frontend Unit Tests App Component colors.length === 0 shows loading text",""
"","27","Component Tests ColorPicker typing in name input clears name error","","Mon Apr 20 17:49:36 UTC 2026","passed","Mon Apr 20 17:49:36 UTC 2026","","Utility Functions","Component Tests ColorPicker typing in name input clears name error",""
"","12","Component Tests ColorPicker wheel cursor moves to (220,110) after right-edge click (hue=0, sat=1)","","Mon Apr 20 17:49:36 UTC 2026","passed","Mon Apr 20 17:49:36 UTC 2026","","Utility Functions","Component Tests ColorPicker wheel cursor moves to (220,110) after right-edge click (hue=0, sat=1)",""
"","469","should handle missing image gracefully by showing alt text","Chrome","Mon Apr 20 18:05:59 UTC 2026","passed","Mon Apr 20 18:06:00 UTC 2026","Network Mocking & Interception","tests/network-mocking.spec.ts","",""
"","58","Frontend Unit Tests App Component confirm button shows ""Deleting…"" label while delete is in-flight","","Mon Apr 20 17:49:36 UTC 2026","passed","Mon Apr 20 17:49:36 UTC 2026","","Frontend Unit Tests","Frontend Unit Tests App Component confirm button shows ""Deleting…"" label while delete is in-flight",""
"","24","Frontend Unit Tests App Component shows add-color button even when colors are empty","","Mon Apr 20 17:49:36 UTC 2026","passed","Mon Apr 20 17:49:36 UTC 2026","","Frontend Unit Tests","Frontend Unit Tests App Component shows add-color button even when colors are empty",""
"","10","Server Integration Tests (Testcontainers) POST /api/colors should accept a color name containing spaces","","Mon Apr 20 17:51:43 UTC 2026","passed","Mon Apr 20 17:51:43 UTC 2026","","Server Integration Tests (Testcontainers)","Server Integration Tests (Testcontainers) POST /api/colors should accept a color name containing spaces",""
"","4","Server Unit Tests POST /api/colors returns 400 for invalid hex format (no hash)","","Mon Apr 20 17:54:39 UTC 2026","passed","Mon Apr 20 17:54:39 UTC 2026","","Server Unit Tests","Server Unit Tests POST /api/colors returns 400 for invalid hex format (no hash)",""
"","254","Server Unit Tests Surviving Mutants & Edge Cases Port Fallback reflects process.env.PORT in Swagger servers","","Mon Apr 20 17:54:39 UTC 2026","passed","Mon Apr 20 17:54:39 UTC 2026","","Server Unit Tests","Server Unit Tests Surviving Mutants & Edge Cases Port Fallback reflects process.env.PORT in Swagger servers",""
"","39","Frontend Unit Tests App Component add color network error shows network error message","","Mon Apr 20 17:49:36 UTC 2026","passed","Mon Apr 20 17:49:36 UTC 2026","","Frontend Unit Tests","Frontend Unit Tests App Component add color network error shows network error message",""
"","0","Utility Functions paintWheelPixel sets alpha to 0 when dist > r (outside circle)","","Mon Apr 20 17:49:36 UTC 2026","passed","Mon Apr 20 17:49:36 UTC 2026","","Utility Functions","Utility Functions paintWheelPixel sets alpha to 0 when dist > r (outside circle)",""
"","4","Server Unit Tests Middleware JSON error middleware ignores SyntaxError without body","","Mon Apr 20 17:54:39 UTC 2026","passed","Mon Apr 20 17:54:39 UTC 2026","","Server Unit Tests","Server Unit Tests Middleware JSON error middleware ignores SyntaxError without body",""
"","711","shows a chip for each color with a swatch, name, and delete button","Chrome","Mon Apr 20 18:17:16 UTC 2026","passed","Mon Apr 20 18:17:16 UTC 2026","Color Management — Add & Delete","tests/color-management.spec.ts","",""
"","601","verify Turquoise ( #1abc9c ) is applied as the background color","Chrome","Mon Apr 20 18:06:01 UTC 2026","passed","Mon Apr 20 18:06:02 UTC 2026","POM Refactored: Background color tests","tests/pom-refactored.spec.ts","",""
"","78","Frontend Unit Tests App Component deleting is false again after a failed delete (finally block)","","Mon Apr 20 17:49:36 UTC 2026","passed","Mon Apr 20 17:49:36 UTC 2026","","Frontend Unit Tests","Frontend Unit Tests App Component deleting is false again after a failed delete (finally block)",""
"","3","Server Unit Tests POST /api/colors returns 400 for invalid hex format (too short)","","Mon Apr 20 17:54:39 UTC 2026","passed","Mon Apr 20 17:54:39 UTC 2026","","Server Unit Tests","Server Unit Tests POST /api/colors returns 400 for invalid hex format (too short)",""
"","1400","should display all core elements and handle button interaction","Chrome","Mon Apr 20 18:18:52 UTC 2026","passed","Mon Apr 20 18:18:53 UTC 2026","Responsive Design – tablet (768×1024)","","",""
"","586","Example #3","BDD","Mon Apr 20 18:17:13 UTC 2026","passed","Mon Apr 20 18:17:14 UTC 2026","Language Switching > Switch language and verify translated UI labels","","",""
"","1653","successfully adds a new color and shows its chip","Chrome","Mon Apr 20 18:17:19 UTC 2026","passed","Mon Apr 20 18:17:20 UTC 2026","Color Management — Add & Delete","tests/color-management.spec.ts","",""
"","3","Server Unit Tests POST /api/colors returns 400 when hex is missing","","Mon Apr 20 17:54:39 UTC 2026","passed","Mon Apr 20 17:54:39 UTC 2026","","Server Unit Tests","Server Unit Tests POST /api/colors returns 400 when hex is missing",""
"","35","Component Tests ColorPicker mousemove after mouseup does NOT update color (dragging stopped)","","Mon Apr 20 17:49:36 UTC 2026","passed","Mon Apr 20 17:49:36 UTC 2026","","Utility Functions","Component Tests ColorPicker mousemove after mouseup does NOT update color (dragging stopped)",""
"","0","Utility Functions rgbToHex value 15 pads to 0f","","Mon Apr 20 17:49:36 UTC 2026","passed","Mon Apr 20 17:49:36 UTC 2026","","Utility Functions","Utility Functions rgbToHex value 15 pads to 0f",""
"","8","NoSQL operator in GET path param is rejected (400 or 404)","Chrome","Mon Apr 20 18:12:35 UTC 2026","passed","Mon Apr 20 18:12:35 UTC 2026","Security > Injection Prevention","tests/security.spec.ts","",""
"","9","Server Integration Tests (Testcontainers) POST /api/colors should not expose _id or __v in the creation response","","Mon Apr 20 17:51:43 UTC 2026","passed","Mon Apr 20 17:51:43 UTC 2026","","Server Integration Tests (Testcontainers)","Server Integration Tests (Testcontainers) POST /api/colors should not expose _id or __v in the creation response",""
"","1","Utility Functions hexToRgb parses a standard #RRGGBB hex","","Mon Apr 20 17:49:36 UTC 2026","passed","Mon Apr 20 17:49:36 UTC 2026","","Utility Functions","Utility Functions hexToRgb parses a standard #RRGGBB hex",""
"","1178","delete API error shows alert banner","Chrome","Mon Apr 20 18:17:25 UTC 2026","passed","Mon Apr 20 18:17:26 UTC 2026","Color Management — Add & Delete","tests/color-management.spec.ts","",""
"","0","Utility Functions readableOn returns #111 for a pale/pastel colour (high luminance)","","Mon Apr 20 17:49:36 UTC 2026","passed","Mon Apr 20 17:49:36 UTC 2026","","Utility Functions","Utility Functions readableOn returns #111 for a pale/pastel colour (high luminance)",""
"","21","should reject missing name","Chrome","Mon Apr 20 18:17:06 UTC 2026","passed","Mon Apr 20 18:17:06 UTC 2026","Backend API Integration > POST /api/colors Schema Validation","","",""
"","3","Server Unit Tests Surviving Mutants & Edge Cases Swagger Metadata & OpenAPI has exact application/json content-type","","Mon Apr 20 17:54:39 UTC 2026","passed","Mon Apr 20 17:54:39 UTC 2026","","Server Unit Tests","Server Unit Tests Surviving Mutants & Edge Cases Swagger Metadata & OpenAPI has exact application/json content-type",""
"","9","Server Integration Tests (Testcontainers) POST /api/colors should return 400 for invalid hex format (missing #)","","Mon Apr 20 17:51:43 UTC 2026","passed","Mon Apr 20 17:51:43 UTC 2026","","Server Integration Tests (Testcontainers)","Server Integration Tests (Testcontainers) POST /api/colors should return 400 for invalid hex format (missing #)",""
"","612","first color chip is active on load (aria-pressed=true)","Chrome","Mon Apr 20 18:17:16 UTC 2026","passed","Mon Apr 20 18:17:16 UTC 2026","Color Management — Add & Delete","tests/color-management.spec.ts","",""
