"DESCRIPTION","DURATION IN MS","NAME","PARENT SUITE","START TIME","STATUS","STOP TIME","SUB SUITE","SUITE","TEST CLASS","TEST METHOD"
"","3","Server Unit Tests Surviving Mutants & Edge Cases Swagger Metadata & OpenAPI has exact info metadata","","Sat Apr 25 16:57:08 UTC 2026","passed","Sat Apr 25 16:57:08 UTC 2026","","Server Unit Tests","Server Unit Tests Surviving Mutants & Edge Cases Swagger Metadata & OpenAPI has exact info metadata",""
"","1894","should maintain accessibility in es language and verify resilient locators","Chrome","Sat Apr 25 17:01:58 UTC 2026","passed","Sat Apr 25 17:02:00 UTC 2026","i18n Accessibility Tests","tests/a11y.spec.ts","",""
"","0","Utility Functions hslToRgb hue=60 (yellow) → [255,255,0]","","Sat Apr 25 16:57:26 UTC 2026","passed","Sat Apr 25 16:57:26 UTC 2026","","Utility Functions","Utility Functions hslToRgb hue=60 (yellow) → [255,255,0]",""
"","14","GET /api/colors should return all colors","Chrome","Sat Apr 25 17:02:02 UTC 2026","passed","Sat Apr 25 17:02:02 UTC 2026","Backend API Integration","tests/api.spec.ts","",""
"","8","malformed JSON body returns 400","Chrome","Sat Apr 25 17:01:05 UTC 2026","passed","Sat Apr 25 17:01:05 UTC 2026","Security > Input Validation","tests/security.spec.ts","",""
"","19","Component Tests ColorPicker typing red with g<b hex updates internal state","","Sat Apr 25 16:57:26 UTC 2026","passed","Sat Apr 25 16:57:26 UTC 2026","","Utility Functions","Component Tests ColorPicker typing red with g<b hex updates internal state",""
"","568","homepage should match snapshot","Chrome","Sat Apr 25 17:03:36 UTC 2026","passed","Sat Apr 25 17:03:37 UTC 2026","Visual Regression – iphone-landscape (667×375)","","",""
"","11","Server Unit Tests Error Handling POST /api/colors returns 500 when database fails (create)","","Sat Apr 25 16:57:08 UTC 2026","passed","Sat Apr 25 16:57:08 UTC 2026","","Server Unit Tests","Server Unit Tests Error Handling POST /api/colors returns 500 when database fails (create)",""
"","0","Utility Functions hslToRgb saturation clamped: s=1.5 treated as s=1","","Sat Apr 25 16:57:26 UTC 2026","passed","Sat Apr 25 16:57:26 UTC 2026","","Utility Functions","Utility Functions hslToRgb saturation clamped: s=1.5 treated as s=1",""
"","45","Frontend Unit Tests App Component add color 429 rate limit shows specific message","","Sat Apr 25 16:57:26 UTC 2026","passed","Sat Apr 25 16:57:26 UTC 2026","","Frontend Unit Tests","Frontend Unit Tests App Component add color 429 rate limit shows specific message",""
"","1","Utility Functions rgbToHex converts pure blue","","Sat Apr 25 16:57:26 UTC 2026","passed","Sat Apr 25 16:57:26 UTC 2026","","Utility Functions","Utility Functions rgbToHex converts pure blue",""
"","5","Server Unit Tests 405 Method Not Allowed does not return 405 for allowed PUT method on /api/colors/:name","","Sat Apr 25 16:57:08 UTC 2026","passed","Sat Apr 25 16:57:08 UTC 2026","","Server Unit Tests","Server Unit Tests 405 Method Not Allowed does not return 405 for allowed PUT method on /api/colors/:name",""
"","7","PATCH /api/colors returns 405","Chrome","Sat Apr 25 17:01:05 UTC 2026","passed","Sat Apr 25 17:01:05 UTC 2026","Security > HTTP Method Restrictions","tests/security.spec.ts","",""
"","13","Server Unit Tests Surviving Mutants & Edge Cases Regex & Validation STRICT_NAME_REGEX kills mutants on optionality and length","","Sat Apr 25 16:57:08 UTC 2026","passed","Sat Apr 25 16:57:08 UTC 2026","","Server Unit Tests","Server Unit Tests Surviving Mutants & Edge Cases Regex & Validation STRICT_NAME_REGEX kills mutants on optionality and length",""
"","42","Component Tests ConfirmDialog confirm button calls onConfirm","","Sat Apr 25 16:57:26 UTC 2026","passed","Sat Apr 25 16:57:26 UTC 2026","","Component Tests","Component Tests ConfirmDialog confirm button calls onConfirm",""
"","31","Frontend Unit Tests App Component picker × button closes the modal","","Sat Apr 25 16:57:26 UTC 2026","passed","Sat Apr 25 16:57:26 UTC 2026","","Frontend Unit Tests","Frontend Unit Tests App Component picker × button closes the modal",""
"","1","Frontend Unit Tests i18n Configuration should be initialized with correct settings","","Sat Apr 25 16:57:28 UTC 2026","passed","Sat Apr 25 16:57:28 UTC 2026","","Frontend Unit Tests","Frontend Unit Tests i18n Configuration should be initialized with correct settings",""
"","66","Frontend Unit Tests App Component handles non-array initial fetch response gracefully","","Sat Apr 25 16:57:26 UTC 2026","passed","Sat Apr 25 16:57:26 UTC 2026","","Frontend Unit Tests","Frontend Unit Tests App Component handles non-array initial fetch response gracefully",""
"","31","Component Tests ColorPicker hex input updates hue/sat via rgbToHsl (green → hue≈120)","","Sat Apr 25 16:57:26 UTC 2026","passed","Sat Apr 25 16:57:26 UTC 2026","","Utility Functions","Component Tests ColorPicker hex input updates hue/sat via rgbToHsl (green → hue≈120)",""
"","4","Server Unit Tests Surviving Mutants & Edge Cases Swagger Metadata & OpenAPI has exact server metadata","","Sat Apr 25 16:57:08 UTC 2026","passed","Sat Apr 25 16:57:08 UTC 2026","","Server Unit Tests","Server Unit Tests Surviving Mutants & Edge Cases Swagger Metadata & OpenAPI has exact server metadata",""
"","4968","should load the application and verify core functionality across browsers","WebKit","Sat Apr 25 17:01:36 UTC 2026","passed","Sat Apr 25 17:01:41 UTC 2026","Cross-Browser Core Functionality","","",""
"","4","Server Unit Tests PUT /api/colors/:name returns 400 for invalid name in path (regex check)","","Sat Apr 25 16:57:08 UTC 2026","passed","Sat Apr 25 16:57:08 UTC 2026","","Server Unit Tests","Server Unit Tests PUT /api/colors/:name returns 400 for invalid name in path (regex check)",""
"","0","Utility Functions hslToRgb lightness=1 gives white","","Sat Apr 25 16:57:26 UTC 2026","passed","Sat Apr 25 16:57:26 UTC 2026","","Utility Functions","Utility Functions hslToRgb lightness=1 gives white",""
"","10","Server Integration Tests (Testcontainers) GET /api/colors/:name should return correct data for Turquoise","","Sat Apr 25 16:57:05 UTC 2026","passed","Sat Apr 25 16:57:05 UTC 2026","","Server Integration Tests (Testcontainers)","Server Integration Tests (Testcontainers) GET /api/colors/:name should return correct data for Turquoise",""
"","0","Utility Functions paintWheelPixel anti-aliases the outermost ring: dist=r gives alpha=0","","Sat Apr 25 16:57:26 UTC 2026","passed","Sat Apr 25 16:57:26 UTC 2026","","Utility Functions","Utility Functions paintWheelPixel anti-aliases the outermost ring: dist=r gives alpha=0",""
"","5","Component Tests ConfirmDialog Escape key does NOT call onCancel when busy","","Sat Apr 25 16:57:26 UTC 2026","passed","Sat Apr 25 16:57:26 UTC 2026","","Component Tests","Component Tests ConfirmDialog Escape key does NOT call onCancel when busy",""
"","0","homepage after color change","Chrome","Sat Apr 25 17:03:38 UTC 2026","skipped","Sat Apr 25 17:03:38 UTC 2026","Percy Visual Regression – Production > Percy – desktop-xl (1920×1080)","","",""
"","603","Color button remains functional after switching language","BDD","Sat Apr 25 17:01:31 UTC 2026","passed","Sat Apr 25 17:01:31 UTC 2026","Language Switching","","",""
"","1225","should display all core elements and handle button interaction","Chrome","Sat Apr 25 17:03:36 UTC 2026","passed","Sat Apr 25 17:03:38 UTC 2026","Responsive Design – tablet (768×1024)","","",""
"","58","Frontend Unit Tests App Component handleColorClick clears previous error on new successful click","","Sat Apr 25 16:57:26 UTC 2026","passed","Sat Apr 25 16:57:26 UTC 2026","","Frontend Unit Tests","Frontend Unit Tests App Component handleColorClick clears previous error on new successful click",""
"","1002","Example #3","BDD","Sat Apr 25 17:01:29 UTC 2026","passed","Sat Apr 25 17:01:30 UTC 2026","Home Page Background Color > Change background color","","",""
"","1","Utility Functions hslToRgb hue=90 (chartreuse) → [128,255,0]","","Sat Apr 25 16:57:26 UTC 2026","passed","Sat Apr 25 16:57:26 UTC 2026","","Utility Functions","Utility Functions hslToRgb hue=90 (chartreuse) → [128,255,0]",""
"","4","Server Unit Tests Surviving Mutants & Edge Cases Mongoose Schema & Persistence kills empty schema mutant by verifying field persistence","","Sat Apr 25 16:57:08 UTC 2026","passed","Sat Apr 25 16:57:08 UTC 2026","","Server Unit Tests","Server Unit Tests Surviving Mutants & Edge Cases Mongoose Schema & Persistence kills empty schema mutant by verifying field persistence",""
"","5","Component Tests ConfirmDialog backdrop click does NOT call onCancel when busy","","Sat Apr 25 16:57:26 UTC 2026","passed","Sat Apr 25 16:57:26 UTC 2026","","Component Tests","Component Tests ConfirmDialog backdrop click does NOT call onCancel when busy",""
"","6","Server Integration Tests (Testcontainers) POST /api/colors should return 400 for invalid hex format (missing #)","","Sat Apr 25 16:57:05 UTC 2026","passed","Sat Apr 25 16:57:05 UTC 2026","","Server Integration Tests (Testcontainers)","Server Integration Tests (Testcontainers) POST /api/colors should return 400 for invalid hex format (missing #)",""
"","1","Utility Functions hslToRgb lightness=0 gives black","","Sat Apr 25 16:57:26 UTC 2026","passed","Sat Apr 25 16:57:26 UTC 2026","","Utility Functions","Utility Functions hslToRgb lightness=0 gives black",""
"","1701","should maintain accessibility in el language and verify resilient locators","Chrome","Sat Apr 25 17:02:00 UTC 2026","passed","Sat Apr 25 17:02:01 UTC 2026","i18n Accessibility Tests","tests/a11y.spec.ts","",""
"","22","Component Tests ColorPicker duplicate check is case-insensitive","","Sat Apr 25 16:57:26 UTC 2026","passed","Sat Apr 25 16:57:26 UTC 2026","","Utility Functions","Component Tests ColorPicker duplicate check is case-insensitive",""
"","691","handle initial fetch error","Chrome","Sat Apr 25 17:01:16 UTC 2026","passed","Sat Apr 25 17:01:16 UTC 2026","Edge cases and error handling","tests/coverage.spec.ts","",""
"","12","Server Integration Tests (Testcontainers) PUT /api/colors/:name should update the hex of an existing color and persist it in the real database","","Sat Apr 25 16:57:05 UTC 2026","passed","Sat Apr 25 16:57:05 UTC 2026","","Server Integration Tests (Testcontainers)","Server Integration Tests (Testcontainers) PUT /api/colors/:name should update the hex of an existing color and persist it in the real database",""
"","690","shows a chip for each color with a swatch, name, and delete button","Chrome","Sat Apr 25 17:01:01 UTC 2026","passed","Sat Apr 25 17:01:01 UTC 2026","Color Management — Add & Delete","tests/color-management.spec.ts","",""
"","11","NoSQL $where operator in name is rejected (400)","Chrome","Sat Apr 25 17:01:05 UTC 2026","passed","Sat Apr 25 17:01:05 UTC 2026","Security > Injection Prevention","tests/security.spec.ts","",""
"","45","Frontend Unit Tests App Component learn react link has correct text","","Sat Apr 25 16:57:26 UTC 2026","passed","Sat Apr 25 16:57:26 UTC 2026","","Frontend Unit Tests","Frontend Unit Tests App Component learn react link has correct text",""
"","38","Frontend Unit Tests App Component initial background is first color hex","","Sat Apr 25 16:57:26 UTC 2026","passed","Sat Apr 25 16:57:26 UTC 2026","","Frontend Unit Tests","Frontend Unit Tests App Component initial background is first color hex",""
"","6","Server Unit Tests OpenAPI endpoints serves Swagger UI as HTML","","Sat Apr 25 16:57:08 UTC 2026","passed","Sat Apr 25 16:57:08 UTC 2026","","Server Unit Tests","Server Unit Tests OpenAPI endpoints serves Swagger UI as HTML",""
"","0","Utility Functions hslToRgb saturation=0 gives pure grey [128,128,128]","","Sat Apr 25 16:57:26 UTC 2026","passed","Sat Apr 25 16:57:26 UTC 2026","","Utility Functions","Utility Functions hslToRgb saturation=0 gives pure grey [128,128,128]",""
"","0","homepage after color change","Chrome","Sat Apr 25 17:03:38 UTC 2026","skipped","Sat Apr 25 17:03:38 UTC 2026","Percy Visual Regression – Production > Percy – tablet (768×1024)","","",""
"","38","should create a new color with valid schema","Chrome","Sat Apr 25 17:02:02 UTC 2026","passed","Sat Apr 25 17:02:02 UTC 2026","Backend API Integration > POST /api/colors Schema Validation","tests/api.spec.ts","",""
"","55","Frontend Unit Tests App Component header color attribute changes after clicking a chip","","Sat Apr 25 16:57:26 UTC 2026","passed","Sat Apr 25 16:57:26 UTC 2026","","Frontend Unit Tests","Frontend Unit Tests App Component header color attribute changes after clicking a chip",""
"","33","Server Unit Tests Surviving Mutants & Edge Cases Strict Path & Method Validation kills allowedMethods mutants by exhaustive testing","","Sat Apr 25 16:57:08 UTC 2026","passed","Sat Apr 25 16:57:08 UTC 2026","","Server Unit Tests","Server Unit Tests Surviving Mutants & Edge Cases Strict Path & Method Validation kills allowedMethods mutants by exhaustive testing",""
"","7","Frontend Unit Tests App Component current color span tracks hex value","","Sat Apr 25 16:57:26 UTC 2026","passed","Sat Apr 25 16:57:26 UTC 2026","","Frontend Unit Tests","Frontend Unit Tests App Component current color span tracks hex value",""
"","8","Server Unit Tests Surviving Mutants & Edge Cases PUT logic kills name/hex conditional mutants by providing only one field","","Sat Apr 25 16:57:08 UTC 2026","passed","Sat Apr 25 16:57:08 UTC 2026","","Server Unit Tests","Server Unit Tests Surviving Mutants & Edge Cases PUT logic kills name/hex conditional mutants by providing only one field",""
"","1","Utility Functions paintWheelPixel paints red at right edge (dx=r, dy=0, hue=0)","","Sat Apr 25 16:57:26 UTC 2026","passed","Sat Apr 25 16:57:26 UTC 2026","","Utility Functions","Utility Functions paintWheelPixel paints red at right edge (dx=r, dy=0, hue=0)",""
"","19","Server Unit Tests Surviving Mutants & Edge Cases Regex & Validation STRICT_NAME_REGEX kills mutants by testing multiple spaces and pluses in the middle","","Sat Apr 25 16:57:08 UTC 2026","passed","Sat Apr 25 16:57:08 UTC 2026","","Server Unit Tests","Server Unit Tests Surviving Mutants & Edge Cases Regex & Validation STRICT_NAME_REGEX kills mutants by testing multiple spaces and pluses in the middle",""
"","592","changing color to Turquoise should reflect in UI and DOM","Chrome","Sat Apr 25 17:01:17 UTC 2026","passed","Sat Apr 25 17:01:18 UTC 2026","Data-Driven Testing","tests/data-driven.spec.ts","",""
"","1","Utility Functions rgbToHsl b max (#0040ff) → h in (180,300)","","Sat Apr 25 16:57:26 UTC 2026","passed","Sat Apr 25 16:57:26 UTC 2026","","Utility Functions","Utility Functions rgbToHsl b max (#0040ff) → h in (180,300)",""
"","11","should reject updating with empty name","Chrome","Sat Apr 25 17:02:02 UTC 2026","passed","Sat Apr 25 17:02:02 UTC 2026","Backend API Integration > PUT /api/colors/:name Schema Validation","tests/api.spec.ts","",""
"","8","Server Unit Tests GET /api/colors/:name returns Turquoise color correctly","","Sat Apr 25 16:57:08 UTC 2026","passed","Sat Apr 25 16:57:08 UTC 2026","","Server Unit Tests","Server Unit Tests GET /api/colors/:name returns Turquoise color correctly",""
"","28","Component Tests ColorPicker submit is blocked when hex input has an error","","Sat Apr 25 16:57:26 UTC 2026","passed","Sat Apr 25 16:57:26 UTC 2026","","Utility Functions","Component Tests ColorPicker submit is blocked when hex input has an error",""
"","35","Frontend Unit Tests App Component active chip has is-active CSS class","","Sat Apr 25 16:57:26 UTC 2026","passed","Sat Apr 25 16:57:26 UTC 2026","","Frontend Unit Tests","Frontend Unit Tests App Component active chip has is-active CSS class",""
"","983","Cancel button closes the picker","Chrome","Sat Apr 25 17:01:03 UTC 2026","passed","Sat Apr 25 17:01:04 UTC 2026","Color Management — Add & Delete","tests/color-management.spec.ts","",""
"","968","should display colors that do not exist in the database","Chrome","Sat Apr 25 17:01:20 UTC 2026","passed","Sat Apr 25 17:01:21 UTC 2026","Network Mocking & Interception","tests/network-mocking.spec.ts","",""
"","4","Server Unit Tests POST /api/colors returns 400 for extra unknown fields (strict schema)","","Sat Apr 25 16:57:08 UTC 2026","passed","Sat Apr 25 16:57:08 UTC 2026","","Server Unit Tests","Server Unit Tests POST /api/colors returns 400 for extra unknown fields (strict schema)",""
"","35","Frontend Unit Tests App Component add color sends POST with correct method, headers, and body","","Sat Apr 25 16:57:26 UTC 2026","passed","Sat Apr 25 16:57:26 UTC 2026","","Frontend Unit Tests","Frontend Unit Tests App Component add color sends POST with correct method, headers, and body",""
"","16","Component Tests ColorPicker typing a valid hex without # prefix is accepted","","Sat Apr 25 16:57:26 UTC 2026","passed","Sat Apr 25 16:57:26 UTC 2026","","Utility Functions","Component Tests ColorPicker typing a valid hex without # prefix is accepted",""
"","621","chip-x click opens confirm dialog with color name","Chrome","Sat Apr 25 17:01:07 UTC 2026","passed","Sat Apr 25 17:01:08 UTC 2026","Color Management — Add & Delete","tests/color-management.spec.ts","",""
"","10","Frontend Unit Tests App Component shows error alert when initial fetch returns non-2xx","","Sat Apr 25 16:57:26 UTC 2026","passed","Sat Apr 25 16:57:26 UTC 2026","","Frontend Unit Tests","Frontend Unit Tests App Component shows error alert when initial fetch returns non-2xx",""
"","25","Frontend Unit Tests App Component text color on dark background is white","","Sat Apr 25 16:57:26 UTC 2026","passed","Sat Apr 25 16:57:26 UTC 2026","","Frontend Unit Tests","Frontend Unit Tests App Component text color on dark background is white",""
"","3","Server Unit Tests 405 Method Not Allowed sets the Allow header on /api/colors with correct methods","","Sat Apr 25 16:57:08 UTC 2026","passed","Sat Apr 25 16:57:08 UTC 2026","","Server Unit Tests","Server Unit Tests 405 Method Not Allowed sets the Allow header on /api/colors with correct methods",""
"","29","Component Tests ColorPicker touchmove while dragging updates hex","","Sat Apr 25 16:57:26 UTC 2026","passed","Sat Apr 25 16:57:26 UTC 2026","","Utility Functions","Component Tests ColorPicker touchmove while dragging updates hex",""
"","10","Component Tests ColorPicker displays serverError prop in an alert banner","","Sat Apr 25 16:57:26 UTC 2026","passed","Sat Apr 25 16:57:26 UTC 2026","","Utility Functions","Component Tests ColorPicker displays serverError prop in an alert banner",""
"","47","Frontend Unit Tests App Component add color 500 shows server error message","","Sat Apr 25 16:57:26 UTC 2026","passed","Sat Apr 25 16:57:26 UTC 2026","","Frontend Unit Tests","Frontend Unit Tests App Component add color 500 shows server error message",""
"","2423","should not have any automatically detectable accessibility issues","Chrome","Sat Apr 25 17:01:52 UTC 2026","passed","Sat Apr 25 17:01:54 UTC 2026","Accessibility Tests","tests/a11y.spec.ts","",""
"","990","should display all core elements and handle button interaction","Chrome","Sat Apr 25 17:03:37 UTC 2026","passed","Sat Apr 25 17:03:38 UTC 2026","Responsive Design – iPhone SE (375×667)","","",""
"","40","Server Integration Tests (Testcontainers) GET /api/colors should retrieve all seeded colors","","Sat Apr 25 16:57:05 UTC 2026","passed","Sat Apr 25 16:57:05 UTC 2026","","Server Integration Tests (Testcontainers)","Server Integration Tests (Testcontainers) GET /api/colors should retrieve all seeded colors",""
"","11","should return 404 when updating non-existent color","Chrome","Sat Apr 25 17:02:02 UTC 2026","passed","Sat Apr 25 17:02:02 UTC 2026","Backend API Integration > PUT /api/colors/:name Schema Validation","tests/api.spec.ts","",""
"","5","Server Unit Tests Middleware returns 413 for payload too large","","Sat Apr 25 16:57:08 UTC 2026","passed","Sat Apr 25 16:57:08 UTC 2026","","Server Unit Tests","Server Unit Tests Middleware returns 413 for payload too large",""
"","1041","verify Yellow ( #f1c40f ) is applied as the background color","Chrome","Sat Apr 25 17:01:13 UTC 2026","passed","Sat Apr 25 17:01:14 UTC 2026","Background color tests","tests/coverage.spec.ts","",""
"","10","should reject invalid hex format on update","Chrome","Sat Apr 25 17:02:02 UTC 2026","passed","Sat Apr 25 17:02:02 UTC 2026","Backend API Integration > PUT /api/colors/:name Schema Validation","tests/api.spec.ts","",""
"","6","Server Unit Tests GET /api/colors/:name returns Yellow color correctly","","Sat Apr 25 16:57:08 UTC 2026","passed","Sat Apr 25 16:57:08 UTC 2026","","Server Unit Tests","Server Unit Tests GET /api/colors/:name returns Yellow color correctly",""
"","15","Component Tests ColorPicker Enter key on name input triggers submit","","Sat Apr 25 16:57:26 UTC 2026","passed","Sat Apr 25 16:57:26 UTC 2026","","Utility Functions","Component Tests ColorPicker Enter key on name input triggers submit",""
"","4","Server Unit Tests Middleware handles non-JSON content type gracefully on POST","","Sat Apr 25 16:57:08 UTC 2026","passed","Sat Apr 25 16:57:08 UTC 2026","","Server Unit Tests","Server Unit Tests Middleware handles non-JSON content type gracefully on POST",""
"","1","Utility Functions hslToRgb low lightness l=0.25 → [128,0,0]","","Sat Apr 25 16:57:26 UTC 2026","passed","Sat Apr 25 16:57:26 UTC 2026","","Utility Functions","Utility Functions hslToRgb low lightness l=0.25 → [128,0,0]",""
"","0","homepage initial state","Chrome","Sat Apr 25 17:03:38 UTC 2026","skipped","Sat Apr 25 17:03:38 UTC 2026","Percy Visual Regression – Production > Percy – mobile (375×667)","","",""
"","6","Frontend Unit Tests App Component language selector change calls i18n and updates html lang","","Sat Apr 25 16:57:26 UTC 2026","passed","Sat Apr 25 16:57:26 UTC 2026","","Frontend Unit Tests","Frontend Unit Tests App Component language selector change calls i18n and updates html lang",""
"","1","Utility Functions hslToRgb hue=360 wraps to hue=0 → [255,0,0]","","Sat Apr 25 16:57:26 UTC 2026","passed","Sat Apr 25 16:57:26 UTC 2026","","Utility Functions","Utility Functions hslToRgb hue=360 wraps to hue=0 → [255,0,0]",""
"","23","Component Tests ColorPicker typing a valid hex clears the hex error and updates preview","","Sat Apr 25 16:57:26 UTC 2026","passed","Sat Apr 25 16:57:26 UTC 2026","","Utility Functions","Component Tests ColorPicker typing a valid hex clears the hex error and updates preview",""
"","53","Frontend Unit Tests App Component saving is false again after a failed add (finally block)","","Sat Apr 25 16:57:26 UTC 2026","passed","Sat Apr 25 16:57:26 UTC 2026","","Frontend Unit Tests","Frontend Unit Tests App Component saving is false again after a failed add (finally block)",""
"","11","Server Integration Tests (Testcontainers) seedDatabase should be idempotent — calling twice always yields exactly 3 colors","","Sat Apr 25 16:57:05 UTC 2026","passed","Sat Apr 25 16:57:05 UTC 2026","","Server Integration Tests (Testcontainers)","Server Integration Tests (Testcontainers) seedDatabase should be idempotent — calling twice always yields exactly 3 colors",""
"","4","Server Unit Tests PUT /api/colors/:name returns 400 when no fields are provided (empty body)","","Sat Apr 25 16:57:08 UTC 2026","passed","Sat Apr 25 16:57:08 UTC 2026","","Server Unit Tests","Server Unit Tests PUT /api/colors/:name returns 400 when no fields are provided (empty body)",""
"","0","Utility Functions rgbToHex pads single-digit hex values with leading zero","","Sat Apr 25 16:57:26 UTC 2026","passed","Sat Apr 25 16:57:26 UTC 2026","","Utility Functions","Utility Functions rgbToHex pads single-digit hex values with leading zero",""
"","15","Component Tests ColorPicker typing an invalid hex shows ""Use format #RRGGBB"" error","","Sat Apr 25 16:57:26 UTC 2026","passed","Sat Apr 25 16:57:26 UTC 2026","","Utility Functions","Component Tests ColorPicker typing an invalid hex shows ""Use format #RRGGBB"" error",""
"","0","Utility Functions hslToRgb hue=330 (rose) → [255,0,128]","","Sat Apr 25 16:57:26 UTC 2026","passed","Sat Apr 25 16:57:26 UTC 2026","","Utility Functions","Utility Functions hslToRgb hue=330 (rose) → [255,0,128]",""
"","0","homepage after color change","Chrome","Sat Apr 25 17:03:38 UTC 2026","skipped","Sat Apr 25 17:03:38 UTC 2026","Percy Visual Regression – Production > Percy – mobile (375×667)","","",""
"","76","Frontend Unit Tests App Component fetches and displays color chips with swatch and delete button","","Sat Apr 25 16:57:26 UTC 2026","passed","Sat Apr 25 16:57:26 UTC 2026","","Frontend Unit Tests","Frontend Unit Tests App Component fetches and displays color chips with swatch and delete button",""
"","1","Frontend Unit Tests i18n Configuration should have translation keys in resources","","Sat Apr 25 16:57:28 UTC 2026","passed","Sat Apr 25 16:57:28 UTC 2026","","Frontend Unit Tests","Frontend Unit Tests i18n Configuration should have translation keys in resources",""
"","1036","should create color via API and verify through UI","Chrome","Sat Apr 25 17:01:20 UTC 2026","passed","Sat Apr 25 17:01:21 UTC 2026","Hybrid E2E Testing","tests/hybrid.spec.ts","",""
"","18","Component Tests ConfirmDialog cancel button calls onCancel","","Sat Apr 25 16:57:26 UTC 2026","passed","Sat Apr 25 16:57:26 UTC 2026","","Component Tests","Component Tests ConfirmDialog cancel button calls onCancel",""
"","7","Component Tests ColorPicker serverError banner is absent when serverError is null","","Sat Apr 25 16:57:26 UTC 2026","passed","Sat Apr 25 16:57:26 UTC 2026","","Utility Functions","Component Tests ColorPicker serverError banner is absent when serverError is null",""
"","9","Component Tests ColorPicker clicking inside the card does NOT call onCancel","","Sat Apr 25 16:57:26 UTC 2026","passed","Sat Apr 25 16:57:26 UTC 2026","","Utility Functions","Component Tests ColorPicker clicking inside the card does NOT call onCancel",""
