"DESCRIPTION","DURATION IN MS","NAME","PARENT SUITE","START TIME","STATUS","STOP TIME","SUB SUITE","SUITE","TEST CLASS","TEST METHOD"
"","1","Utility Functions rgbToHsl round-trip hslToRgb→rgbToHsl preserves hue for all sectors","","Sat Apr 25 16:57:26 UTC 2026","passed","Sat Apr 25 16:57:26 UTC 2026","","Utility Functions","Utility Functions rgbToHsl round-trip hslToRgb→rgbToHsl preserves hue for all sectors",""
"","0","Utility Functions rgbToHsl r max, g>0, b=0 → h in (0,60)","","Sat Apr 25 16:57:26 UTC 2026","passed","Sat Apr 25 16:57:26 UTC 2026","","Utility Functions","Utility Functions rgbToHsl r max, g>0, b=0 → h in (0,60)",""
"","1","Utility Functions hexToRgb parses a standard #RRGGBB hex","","Sat Apr 25 16:57:26 UTC 2026","passed","Sat Apr 25 16:57:26 UTC 2026","","Utility Functions","Utility Functions hexToRgb parses a standard #RRGGBB hex",""
"","8","Server Integration Tests (Testcontainers) GET /api/colors/:name should return 404 for a non-existent color","","Sat Apr 25 16:57:05 UTC 2026","passed","Sat Apr 25 16:57:05 UTC 2026","","Server Integration Tests (Testcontainers)","Server Integration Tests (Testcontainers) GET /api/colors/:name should return 404 for a non-existent color",""
"","9","Server Unit Tests Error Handling POST /api/colors returns 500 when database fails (findOne)","","Sat Apr 25 16:57:08 UTC 2026","passed","Sat Apr 25 16:57:08 UTC 2026","","Server Unit Tests","Server Unit Tests Error Handling POST /api/colors returns 500 when database fails (findOne)",""
"","34","Frontend Unit Tests App Component confirm dialog Escape key closes it","","Sat Apr 25 16:57:26 UTC 2026","passed","Sat Apr 25 16:57:26 UTC 2026","","Frontend Unit Tests","Frontend Unit Tests App Component confirm dialog Escape key closes it",""
"","42","Frontend Unit Tests App Component existingNames passed to ColorPicker matches current color list","","Sat Apr 25 16:57:26 UTC 2026","passed","Sat Apr 25 16:57:26 UTC 2026","","Frontend Unit Tests","Frontend Unit Tests App Component existingNames passed to ColorPicker matches current color list",""
"","1","Utility Functions hslToRgb hue=150 (spring green) → [0,255,128]","","Sat Apr 25 16:57:26 UTC 2026","passed","Sat Apr 25 16:57:26 UTC 2026","","Utility Functions","Utility Functions hslToRgb hue=150 (spring green) → [0,255,128]",""
"","4","Server Unit Tests Middleware JSON error middleware ignores SyntaxError without body","","Sat Apr 25 16:57:08 UTC 2026","passed","Sat Apr 25 16:57:08 UTC 2026","","Server Unit Tests","Server Unit Tests Middleware JSON error middleware ignores SyntaxError without body",""
"","1016","changing color to Yellow should reflect in UI and DOM","Chrome","Sat Apr 25 17:01:18 UTC 2026","passed","Sat Apr 25 17:01:19 UTC 2026","Data-Driven Testing","tests/data-driven.spec.ts","",""
"","60","Frontend Unit Tests App Component first loaded color is active (aria-pressed=true)","","Sat Apr 25 16:57:26 UTC 2026","passed","Sat Apr 25 16:57:26 UTC 2026","","Frontend Unit Tests","Frontend Unit Tests App Component first loaded color is active (aria-pressed=true)",""
"","1061","successful delete removes the chip","Chrome","Sat Apr 25 17:01:09 UTC 2026","passed","Sat Apr 25 17:01:10 UTC 2026","Color Management — Add & Delete","tests/color-management.spec.ts","",""
"","8","Server Integration Tests (Testcontainers) GET /api/colors/:name should return 400 for invalid name format","","Sat Apr 25 16:57:05 UTC 2026","passed","Sat Apr 25 16:57:05 UTC 2026","","Server Integration Tests (Testcontainers)","Server Integration Tests (Testcontainers) GET /api/colors/:name should return 400 for invalid name format",""
"","21","Component Tests ColorPicker touch start on canvas sets hex to #ff0000 at right edge","","Sat Apr 25 16:57:26 UTC 2026","passed","Sat Apr 25 16:57:26 UTC 2026","","Utility Functions","Component Tests ColorPicker touch start on canvas sets hex to #ff0000 at right edge",""
"","116","Component Tests ColorPicker renders the modal with title, hex preview, name and hex inputs","","Sat Apr 25 16:57:26 UTC 2026","passed","Sat Apr 25 16:57:26 UTC 2026","","Utility Functions","Component Tests ColorPicker renders the modal with title, hex preview, name and hex inputs",""
"","4","Server Unit Tests OpenAPI endpoints serves the OpenAPI JSON spec with exact metadata","","Sat Apr 25 16:57:08 UTC 2026","passed","Sat Apr 25 16:57:08 UTC 2026","","Server Unit Tests","Server Unit Tests OpenAPI endpoints serves the OpenAPI JSON spec with exact metadata",""
"","978","DELETE /api/colors/{name}","","","passed","","","schemathesis","",""
"","169","Component Tests ConfirmDialog renders title, body, and both buttons","","Sat Apr 25 16:57:26 UTC 2026","passed","Sat Apr 25 16:57:26 UTC 2026","","Component Tests","Component Tests ConfirmDialog renders title, body, and both buttons",""
"","22","Server Integration Tests (Testcontainers) POST /api/colors should create a new color and persist it in the real database","","Sat Apr 25 16:57:05 UTC 2026","passed","Sat Apr 25 16:57:05 UTC 2026","","Server Integration Tests (Testcontainers)","Server Integration Tests (Testcontainers) POST /api/colors should create a new color and persist it in the real database",""
"","25","GET /api/colors","","","skipped","","","schemathesis","",""
"","2","Frontend Unit Tests i18n Configuration should handle language change correctly","","Sat Apr 25 16:57:28 UTC 2026","passed","Sat Apr 25 16:57:28 UTC 2026","","Frontend Unit Tests","Frontend Unit Tests i18n Configuration should handle language change correctly",""
"","4","Server Unit Tests Error Handling DELETE /api/colors/:name returns 500 when database fails","","Sat Apr 25 16:57:08 UTC 2026","passed","Sat Apr 25 16:57:08 UTC 2026","","Server Unit Tests","Server Unit Tests Error Handling DELETE /api/colors/:name returns 500 when database fails",""
"","116","Frontend Unit Tests App Component clicking a color chip makes it active","","Sat Apr 25 16:57:26 UTC 2026","passed","Sat Apr 25 16:57:26 UTC 2026","","Frontend Unit Tests","Frontend Unit Tests App Component clicking a color chip makes it active",""
"","502","should handle missing image gracefully by showing alt text","Chrome","Sat Apr 25 17:01:20 UTC 2026","passed","Sat Apr 25 17:01:20 UTC 2026","Network Mocking & Interception","tests/network-mocking.spec.ts","",""
"","65","Frontend Unit Tests App Component useEffect runs only once on mount","","Sat Apr 25 16:57:26 UTC 2026","passed","Sat Apr 25 16:57:26 UTC 2026","","Frontend Unit Tests","Frontend Unit Tests App Component useEffect runs only once on mount",""
"","24","Component Tests ColorPicker mousedown outside circle clamps sat to 1","","Sat Apr 25 16:57:26 UTC 2026","passed","Sat Apr 25 16:57:26 UTC 2026","","Utility Functions","Component Tests ColorPicker mousedown outside circle clamps sat to 1",""
"","1","Frontend Unit Tests i18n Configuration should have defined resources for en, es, el","","Sat Apr 25 16:57:28 UTC 2026","passed","Sat Apr 25 16:57:28 UTC 2026","","Frontend Unit Tests","Frontend Unit Tests i18n Configuration should have defined resources for en, es, el",""
"","49","Frontend Unit Tests App Component add color 400 shows data.error message","","Sat Apr 25 16:57:26 UTC 2026","passed","Sat Apr 25 16:57:26 UTC 2026","","Frontend Unit Tests","Frontend Unit Tests App Component add color 400 shows data.error message",""
"","0","Utility Functions rgbToHex converts arbitrary color","","Sat Apr 25 16:57:26 UTC 2026","passed","Sat Apr 25 16:57:26 UTC 2026","","Utility Functions","Utility Functions rgbToHex converts arbitrary color",""
"","9","unknown extra fields in POST body are rejected (400)","Chrome","Sat Apr 25 17:01:05 UTC 2026","passed","Sat Apr 25 17:01:05 UTC 2026","Security > Input Validation","tests/security.spec.ts","",""
"","3","Server Unit Tests Surviving Mutants & Edge Cases PUT logic kills refine mutant by sending empty body","","Sat Apr 25 16:57:08 UTC 2026","passed","Sat Apr 25 16:57:08 UTC 2026","","Server Unit Tests","Server Unit Tests Surviving Mutants & Edge Cases PUT logic kills refine mutant by sending empty body",""
"","4","Server Unit Tests 405 Method Not Allowed does not return 405 for allowed DELETE method on /api/colors/:name","","Sat Apr 25 16:57:08 UTC 2026","passed","Sat Apr 25 16:57:08 UTC 2026","","Server Unit Tests","Server Unit Tests 405 Method Not Allowed does not return 405 for allowed DELETE method on /api/colors/:name",""
"","49","Frontend Unit Tests App Component deleting a non-active color keeps the current background","","Sat Apr 25 16:57:26 UTC 2026","passed","Sat Apr 25 16:57:26 UTC 2026","","Frontend Unit Tests","Frontend Unit Tests App Component deleting a non-active color keeps the current background",""
"","6","Server Unit Tests POST /api/colors accepts names with alphanumeric characters and spaces","","Sat Apr 25 16:57:08 UTC 2026","passed","Sat Apr 25 16:57:08 UTC 2026","","Server Unit Tests","Server Unit Tests POST /api/colors accepts names with alphanumeric characters and spaces",""
"","971","clicking a chip makes it active","Chrome","Sat Apr 25 17:01:02 UTC 2026","passed","Sat Apr 25 17:01:03 UTC 2026","Color Management — Add & Delete","tests/color-management.spec.ts","",""
"","13","Server Integration Tests (Testcontainers) GET /api/colors/:name should return correct data for Yellow","","Sat Apr 25 16:57:05 UTC 2026","passed","Sat Apr 25 16:57:05 UTC 2026","","Server Integration Tests (Testcontainers)","Server Integration Tests (Testcontainers) GET /api/colors/:name should return correct data for Yellow",""
"","859","verify Yellow ( #f1c40f ) is applied as the background color","Chrome","Sat Apr 25 17:01:22 UTC 2026","passed","Sat Apr 25 17:01:23 UTC 2026","POM Refactored: Background color tests","tests/pom-refactored.spec.ts","",""
"","1","Utility Functions readableOn returns #111 for turquoise (L≈0.39, black gives better contrast)","","Sat Apr 25 16:57:26 UTC 2026","passed","Sat Apr 25 16:57:26 UTC 2026","","Utility Functions","Utility Functions readableOn returns #111 for turquoise (L≈0.39, black gives better contrast)",""
"","14","Component Tests ConfirmDialog clicking the card itself does NOT call onCancel","","Sat Apr 25 16:57:26 UTC 2026","passed","Sat Apr 25 16:57:26 UTC 2026","","Component Tests","Component Tests ConfirmDialog clicking the card itself does NOT call onCancel",""
"","12","should reject missing name","Chrome","Sat Apr 25 17:02:02 UTC 2026","passed","Sat Apr 25 17:02:02 UTC 2026","Backend API Integration > POST /api/colors Schema Validation","tests/api.spec.ts","",""
"","4","Server Unit Tests POST /api/colors returns 400 for name with whitespace","","Sat Apr 25 16:57:08 UTC 2026","passed","Sat Apr 25 16:57:08 UTC 2026","","Server Unit Tests","Server Unit Tests POST /api/colors returns 400 for name with whitespace",""
"","6","Server Integration Tests (Testcontainers) Method Not Allowed should return 405 for PATCH /api/colors/:name","","Sat Apr 25 16:57:05 UTC 2026","passed","Sat Apr 25 16:57:05 UTC 2026","","Server Integration Tests (Testcontainers)","Server Integration Tests (Testcontainers) Method Not Allowed should return 405 for PATCH /api/colors/:name",""
"","3","Server Unit Tests Error Handling seedDatabase logs error when database fails","","Sat Apr 25 16:57:08 UTC 2026","passed","Sat Apr 25 16:57:08 UTC 2026","","Server Unit Tests","Server Unit Tests Error Handling seedDatabase logs error when database fails",""
"","32","Frontend Unit Tests App Component picker cancel button closes the modal","","Sat Apr 25 16:57:26 UTC 2026","passed","Sat Apr 25 16:57:26 UTC 2026","","Frontend Unit Tests","Frontend Unit Tests App Component picker cancel button closes the modal",""
"","3","Server Unit Tests OpenAPI endpoints spec includes component schemas","","Sat Apr 25 16:57:08 UTC 2026","passed","Sat Apr 25 16:57:08 UTC 2026","","Server Unit Tests","Server Unit Tests OpenAPI endpoints spec includes component schemas",""
"","0","mobile color picker workflow","Chrome","Sat Apr 25 17:03:38 UTC 2026","skipped","Sat Apr 25 17:03:38 UTC 2026","Percy Visual Regression – Production > Percy – Mobile Interactions","","",""
"","20","Frontend Unit Tests App Component text color on light background is dark","","Sat Apr 25 16:57:26 UTC 2026","passed","Sat Apr 25 16:57:26 UTC 2026","","Frontend Unit Tests","Frontend Unit Tests App Component text color on light background is dark",""
"","6","Server Unit Tests POST /api/colors applies the createColorLimiter rate limit headers","","Sat Apr 25 16:57:08 UTC 2026","passed","Sat Apr 25 16:57:08 UTC 2026","","Server Unit Tests","Server Unit Tests POST /api/colors applies the createColorLimiter rate limit headers",""
"","7520","should meet the accessibility threshold using Google Lighthouse","Chrome","Sat Apr 25 17:01:56 UTC 2026","passed","Sat Apr 25 17:02:03 UTC 2026","Accessibility Tests","tests/a11y.spec.ts","",""
"","4","Server Unit Tests GET /api/colors/:name returns 400 for invalid name in path (regex check)","","Sat Apr 25 16:57:08 UTC 2026","passed","Sat Apr 25 16:57:08 UTC 2026","","Server Unit Tests","Server Unit Tests GET /api/colors/:name returns 400 for invalid name in path (regex check)",""
"","20","Frontend Unit Tests App Component shows add-color button even when colors are empty","","Sat Apr 25 16:57:26 UTC 2026","passed","Sat Apr 25 16:57:26 UTC 2026","","Frontend Unit Tests","Frontend Unit Tests App Component shows add-color button even when colors are empty",""
"","9","Server Integration Tests (Testcontainers) POST /api/colors should accept a color name containing spaces","","Sat Apr 25 16:57:05 UTC 2026","passed","Sat Apr 25 16:57:05 UTC 2026","","Server Integration Tests (Testcontainers)","Server Integration Tests (Testcontainers) POST /api/colors should accept a color name containing spaces",""
"","4","Server Unit Tests Middleware does not include X-Powered-By header","","Sat Apr 25 16:57:08 UTC 2026","passed","Sat Apr 25 16:57:08 UTC 2026","","Server Unit Tests","Server Unit Tests Middleware does not include X-Powered-By header",""
"","600","Show loading state when the API returns an empty colors list","BDD","Sat Apr 25 17:01:26 UTC 2026","passed","Sat Apr 25 17:01:27 UTC 2026","API Error Handling","","",""
"","0","Utility Functions hexToRgb is case-insensitive","","Sat Apr 25 16:57:26 UTC 2026","passed","Sat Apr 25 16:57:26 UTC 2026","","Utility Functions","Utility Functions hexToRgb is case-insensitive",""
"","11","Server Unit Tests GET /api/colors does not expose _id or __v fields","","Sat Apr 25 16:57:08 UTC 2026","passed","Sat Apr 25 16:57:08 UTC 2026","","Server Unit Tests","Server Unit Tests GET /api/colors does not expose _id or __v fields",""
"","1","Utility Functions rgbToHsl r max with g<b (#ff0040) → h near 345","","Sat Apr 25 16:57:26 UTC 2026","passed","Sat Apr 25 16:57:26 UTC 2026","","Utility Functions","Utility Functions rgbToHsl r max with g<b (#ff0040) → h near 345",""
"","5","Server Unit Tests Surviving Mutants & Edge Cases Rate Limiting & Security kills mutants by verifying x-powered-by is removed","","Sat Apr 25 16:57:08 UTC 2026","passed","Sat Apr 25 16:57:08 UTC 2026","","Server Unit Tests","Server Unit Tests Surviving Mutants & Edge Cases Rate Limiting & Security kills mutants by verifying x-powered-by is removed",""
"","8","Server Unit Tests GET /api/colors returns JSON content type","","Sat Apr 25 16:57:08 UTC 2026","passed","Sat Apr 25 16:57:08 UTC 2026","","Server Unit Tests","Server Unit Tests GET /api/colors returns JSON content type",""
"","307","Server Unit Tests Surviving Mutants & Edge Cases Port Fallback uses default PORT 5001 when process.env.PORT is missing","","Sat Apr 25 16:57:08 UTC 2026","passed","Sat Apr 25 16:57:08 UTC 2026","","Server Unit Tests","Server Unit Tests Surviving Mutants & Edge Cases Port Fallback uses default PORT 5001 when process.env.PORT is missing",""
"","14","Component Tests ColorPicker wheel cursor moves to (220,110) after right-edge click (hue=0, sat=1)","","Sat Apr 25 16:57:26 UTC 2026","passed","Sat Apr 25 16:57:26 UTC 2026","","Utility Functions","Component Tests ColorPicker wheel cursor moves to (220,110) after right-edge click (hue=0, sat=1)",""
"","1","Utility Functions rgbToHsl dark red (#800000): l<0.5, s=1 (l<=0.5 saturation branch)","","Sat Apr 25 16:57:26 UTC 2026","passed","Sat Apr 25 16:57:26 UTC 2026","","Utility Functions","Utility Functions rgbToHsl dark red (#800000): l<0.5, s=1 (l<=0.5 saturation branch)",""
"","17","Server Unit Tests Surviving Mutants & Edge Cases Regex & Validation STRICT_NAME_REGEX is strict on forbidden special characters in the middle","","Sat Apr 25 16:57:08 UTC 2026","passed","Sat Apr 25 16:57:08 UTC 2026","","Server Unit Tests","Server Unit Tests Surviving Mutants & Edge Cases Regex & Validation STRICT_NAME_REGEX is strict on forbidden special characters in the middle",""
"","6","Server Unit Tests 405 Method Not Allowed returns 405 for POST, PUT, DELETE on /openapi.json","","Sat Apr 25 16:57:08 UTC 2026","passed","Sat Apr 25 16:57:08 UTC 2026","","Server Unit Tests","Server Unit Tests 405 Method Not Allowed returns 405 for POST, PUT, DELETE on /openapi.json",""
"","5","Server Unit Tests POST /api/colors returns 409 for a duplicate color name with descriptive error","","Sat Apr 25 16:57:08 UTC 2026","passed","Sat Apr 25 16:57:08 UTC 2026","","Server Unit Tests","Server Unit Tests POST /api/colors returns 409 for a duplicate color name with descriptive error",""
"","7","Server Unit Tests POST /api/colors returns 400 for name with only spaces","","Sat Apr 25 16:57:08 UTC 2026","passed","Sat Apr 25 16:57:08 UTC 2026","","Server Unit Tests","Server Unit Tests POST /api/colors returns 400 for name with only spaces",""
"","4","Server Unit Tests Middleware returns 400 for malformed JSON body","","Sat Apr 25 16:57:08 UTC 2026","passed","Sat Apr 25 16:57:08 UTC 2026","","Server Unit Tests","Server Unit Tests Middleware returns 400 for malformed JSON body",""
"","8","Component Tests ConfirmDialog dialog has correct ARIA attributes","","Sat Apr 25 16:57:26 UTC 2026","passed","Sat Apr 25 16:57:26 UTC 2026","","Component Tests","Component Tests ConfirmDialog dialog has correct ARIA attributes",""
"","17","Frontend Unit Tests App Component labelFor falls back to color name for unknown/custom color","","Sat Apr 25 16:57:26 UTC 2026","passed","Sat Apr 25 16:57:26 UTC 2026","","Frontend Unit Tests","Frontend Unit Tests App Component labelFor falls back to color name for unknown/custom color",""
"","0","Utility Functions rgbToHex converts pure green","","Sat Apr 25 16:57:26 UTC 2026","passed","Sat Apr 25 16:57:26 UTC 2026","","Utility Functions","Utility Functions rgbToHex converts pure green",""
"","0","Frontend Unit Tests i18n Configuration interpolation should not escape value","","Sat Apr 25 16:57:28 UTC 2026","passed","Sat Apr 25 16:57:28 UTC 2026","","Frontend Unit Tests","Frontend Unit Tests i18n Configuration interpolation should not escape value",""
"","10","should reject omitting both name and hex on update","Chrome","Sat Apr 25 17:02:02 UTC 2026","passed","Sat Apr 25 17:02:02 UTC 2026","Backend API Integration > PUT /api/colors/:name Schema Validation","tests/api.spec.ts","",""
"","9","Server Integration Tests (Testcontainers) DELETE /api/colors/:name should delete a color and confirm removal from the real database","","Sat Apr 25 16:57:05 UTC 2026","passed","Sat Apr 25 16:57:05 UTC 2026","","Server Integration Tests (Testcontainers)","Server Integration Tests (Testcontainers) DELETE /api/colors/:name should delete a color and confirm removal from the real database",""
"","2019","deleting the active color switches background to the first remaining","Chrome","Sat Apr 25 17:01:09 UTC 2026","passed","Sat Apr 25 17:01:11 UTC 2026","Color Management — Add & Delete","tests/color-management.spec.ts","",""
"","42","Server Unit Tests GET /api/colors returns all seeded colors with correct names and hex values","","Sat Apr 25 16:57:08 UTC 2026","passed","Sat Apr 25 16:57:08 UTC 2026","","Server Unit Tests","Server Unit Tests GET /api/colors returns all seeded colors with correct names and hex values",""
"","16","Component Tests ConfirmDialog cancelLabel prop is reflected in the button text","","Sat Apr 25 16:57:26 UTC 2026","passed","Sat Apr 25 16:57:26 UTC 2026","","Component Tests","Component Tests ConfirmDialog cancelLabel prop is reflected in the button text",""
"","1360","POST /api/colors","","","passed","","","schemathesis","",""
"","0","Utility Functions readableOn returns #111 for white (very light, L=1)","","Sat Apr 25 16:57:26 UTC 2026","passed","Sat Apr 25 16:57:26 UTC 2026","","Utility Functions","Utility Functions readableOn returns #111 for white (very light, L=1)",""
"","6","Server Unit Tests DELETE /api/colors/:name cannot delete the same color twice","","Sat Apr 25 16:57:08 UTC 2026","passed","Sat Apr 25 16:57:08 UTC 2026","","Server Unit Tests","Server Unit Tests DELETE /api/colors/:name cannot delete the same color twice",""
"","1598","successfully adds a new color and shows its chip","Chrome","Sat Apr 25 17:01:04 UTC 2026","passed","Sat Apr 25 17:01:06 UTC 2026","Color Management — Add & Delete","tests/color-management.spec.ts","",""
"","0","Utility Functions rgbToHsl black [0,0,0] → h=0, s=0, l=0","","Sat Apr 25 16:57:26 UTC 2026","passed","Sat Apr 25 16:57:26 UTC 2026","","Utility Functions","Utility Functions rgbToHsl black [0,0,0] → h=0, s=0, l=0",""
"","711","should handle color click network failure gracefully","Chrome","Sat Apr 25 17:01:19 UTC 2026","passed","Sat Apr 25 17:01:20 UTC 2026","UI Error Handling Coverage","tests/error-handling.spec.ts","",""
"","0","Utility Functions hslToRgb hue=120 (green) → [0,255,0]","","Sat Apr 25 16:57:26 UTC 2026","passed","Sat Apr 25 16:57:26 UTC 2026","","Utility Functions","Utility Functions hslToRgb hue=120 (green) → [0,255,0]",""
"","48","Frontend Unit Tests App Component handleColorClick shows error on non-2xx response","","Sat Apr 25 16:57:26 UTC 2026","passed","Sat Apr 25 16:57:26 UTC 2026","","Frontend Unit Tests","Frontend Unit Tests App Component handleColorClick shows error on non-2xx response",""
"","8","Utility Functions rgbToHsl pure green → h=120, s=1, l=0.5","","Sat Apr 25 16:57:26 UTC 2026","passed","Sat Apr 25 16:57:26 UTC 2026","","Utility Functions","Utility Functions rgbToHsl pure green → h=120, s=1, l=0.5",""
"","8","empty body on POST returns 400","Chrome","Sat Apr 25 17:01:05 UTC 2026","passed","Sat Apr 25 17:01:05 UTC 2026","Security > Input Validation","tests/security.spec.ts","",""
"","9","Component Tests ColorPicker editing name input calls onClearError to clear server error","","Sat Apr 25 16:57:26 UTC 2026","passed","Sat Apr 25 16:57:26 UTC 2026","","Utility Functions","Component Tests ColorPicker editing name input calls onClearError to clear server error",""
"","20","Component Tests ColorPicker Cancel button is disabled when saving=true","","Sat Apr 25 16:57:26 UTC 2026","passed","Sat Apr 25 16:57:26 UTC 2026","","Utility Functions","Component Tests ColorPicker Cancel button is disabled when saving=true",""
"","707","should handle fetch colors network failure gracefully","Chrome","Sat Apr 25 17:01:19 UTC 2026","passed","Sat Apr 25 17:01:19 UTC 2026","UI Error Handling Coverage","tests/error-handling.spec.ts","",""
"","49","Frontend Unit Tests App Component add color 400 without data.error falls back to generic message","","Sat Apr 25 16:57:26 UTC 2026","passed","Sat Apr 25 16:57:26 UTC 2026","","Frontend Unit Tests","Frontend Unit Tests App Component add color 400 without data.error falls back to generic message",""
"","1","Utility Functions paintWheelPixel paints grey at center (dx=0, dy=0, dist=0, sat=0)","","Sat Apr 25 16:57:26 UTC 2026","passed","Sat Apr 25 16:57:26 UTC 2026","","Utility Functions","Utility Functions paintWheelPixel paints grey at center (dx=0, dy=0, dist=0, sat=0)",""
"","79","Frontend Unit Tests App Component deleting is false again after a failed delete (finally block)","","Sat Apr 25 16:57:26 UTC 2026","passed","Sat Apr 25 16:57:26 UTC 2026","","Frontend Unit Tests","Frontend Unit Tests App Component deleting is false again after a failed delete (finally block)",""
"","31","Component Tests ConfirmDialog both buttons are disabled when busy=true","","Sat Apr 25 16:57:26 UTC 2026","passed","Sat Apr 25 16:57:26 UTC 2026","","Component Tests","Component Tests ConfirmDialog both buttons are disabled when busy=true",""
"","15","Component Tests ConfirmDialog confirmLabel prop is reflected in the button text","","Sat Apr 25 16:57:26 UTC 2026","passed","Sat Apr 25 16:57:26 UTC 2026","","Component Tests","Component Tests ConfirmDialog confirmLabel prop is reflected in the button text",""
"","4","Server Unit Tests OpenAPI endpoints has exact application/json content-type","","Sat Apr 25 16:57:08 UTC 2026","passed","Sat Apr 25 16:57:08 UTC 2026","","Server Unit Tests","Server Unit Tests OpenAPI endpoints has exact application/json content-type",""
"","3","Server Unit Tests 405 Method Not Allowed returns 405 for PATCH on /api/colors/:name","","Sat Apr 25 16:57:08 UTC 2026","passed","Sat Apr 25 16:57:08 UTC 2026","","Server Unit Tests","Server Unit Tests 405 Method Not Allowed returns 405 for PATCH on /api/colors/:name",""
"","30","should update a color with valid schema","Chrome","Sat Apr 25 17:02:02 UTC 2026","passed","Sat Apr 25 17:02:02 UTC 2026","Backend API Integration > PUT /api/colors/:name Schema Validation","tests/api.spec.ts","",""
"","5","Server Unit Tests PUT /api/colors/:name does not change name when updating only hex","","Sat Apr 25 16:57:08 UTC 2026","passed","Sat Apr 25 16:57:08 UTC 2026","","Server Unit Tests","Server Unit Tests PUT /api/colors/:name does not change name when updating only hex",""
"","1","Utility Functions rgbToHsl pure blue → h=240, s=1, l=0.5","","Sat Apr 25 16:57:26 UTC 2026","passed","Sat Apr 25 16:57:26 UTC 2026","","Utility Functions","Utility Functions rgbToHsl pure blue → h=240, s=1, l=0.5",""
