"DESCRIPTION","DURATION IN MS","NAME","PARENT SUITE","START TIME","STATUS","STOP TIME","SUB SUITE","SUITE","TEST CLASS","TEST METHOD"
"","22","Server Integration Tests (Testcontainers) POST /api/colors should create a new color and persist it in the real database","","Sat Apr 25 09:18:02 UTC 2026","passed","Sat Apr 25 09:18:02 UTC 2026","","Server Integration Tests (Testcontainers)","Server Integration Tests (Testcontainers) POST /api/colors should create a new color and persist it in the real database",""
"","24","Server Integration Tests (Testcontainers) End-to-end CRUD workflow should create, read, update, and delete a color in sequence","","Sat Apr 25 09:18:02 UTC 2026","passed","Sat Apr 25 09:18:02 UTC 2026","","Server Integration Tests (Testcontainers)","Server Integration Tests (Testcontainers) End-to-end CRUD workflow should create, read, update, and delete a color in sequence",""
"","1","Utility Functions rgbToHsl black [0,0,0] → h=0, s=0, l=0","","Sat Apr 25 09:18:14 UTC 2026","passed","Sat Apr 25 09:18:14 UTC 2026","","Utility Functions","Utility Functions rgbToHsl black [0,0,0] → h=0, s=0, l=0",""
"","5","Server Unit Tests PUT /api/colors/:name updates both name and hex simultaneously","","Sat Apr 25 09:18:02 UTC 2026","passed","Sat Apr 25 09:18:02 UTC 2026","","Server Unit Tests","Server Unit Tests PUT /api/colors/:name updates both name and hex simultaneously",""
"","717","verify language switcher changes document language","Chrome","Sat Apr 25 09:22:19 UTC 2026","passed","Sat Apr 25 09:22:20 UTC 2026","","tests/coverage.spec.ts","",""
"","3","Server Unit Tests Surviving Mutants & Edge Cases Swagger Metadata & OpenAPI has exact info metadata","","Sat Apr 25 09:18:02 UTC 2026","passed","Sat Apr 25 09:18:02 UTC 2026","","Server Unit Tests","Server Unit Tests Surviving Mutants & Edge Cases Swagger Metadata & OpenAPI has exact info metadata",""
"","23","Component Tests ColorPicker mousemove without prior mousedown (not dragging) does not change color","","Sat Apr 25 09:18:14 UTC 2026","passed","Sat Apr 25 09:18:14 UTC 2026","","Utility Functions","Component Tests ColorPicker mousemove without prior mousedown (not dragging) does not change color",""
"","637","first color chip is active on load (aria-pressed=true)","Chrome","Sat Apr 25 09:22:21 UTC 2026","passed","Sat Apr 25 09:22:21 UTC 2026","Color Management — Add & Delete","tests/color-management.spec.ts","",""
"","0","Utility Functions hslToRgb hue=330 (rose) → [255,0,128]","","Sat Apr 25 09:18:14 UTC 2026","passed","Sat Apr 25 09:18:14 UTC 2026","","Utility Functions","Utility Functions hslToRgb hue=330 (rose) → [255,0,128]",""
"","642","homepage should match snapshot","Chrome","Sat Apr 25 09:24:41 UTC 2026","passed","Sat Apr 25 09:24:42 UTC 2026","Visual Regression – iphone-landscape (667×375)","","",""
"","13","Component Tests ColorPicker wheel cursor moves to (220,110) after right-edge click (hue=0, sat=1)","","Sat Apr 25 09:18:14 UTC 2026","passed","Sat Apr 25 09:18:14 UTC 2026","","Utility Functions","Component Tests ColorPicker wheel cursor moves to (220,110) after right-edge click (hue=0, sat=1)",""
"","7","POST /api-docs returns 405","Chrome","Sat Apr 25 09:22:15 UTC 2026","passed","Sat Apr 25 09:22:15 UTC 2026","Security > HTTP Method Restrictions","tests/security.spec.ts","",""
"","22","Frontend Unit Tests App Component labelFor falls back to color name for unknown/custom color","","Sat Apr 25 09:18:14 UTC 2026","passed","Sat Apr 25 09:18:14 UTC 2026","","Frontend Unit Tests","Frontend Unit Tests App Component labelFor falls back to color name for unknown/custom color",""
"","0","Utility Functions rgbToHsl light red (#ff8080): l>0.5, s computed via (2-max-min) branch","","Sat Apr 25 09:18:14 UTC 2026","passed","Sat Apr 25 09:18:14 UTC 2026","","Utility Functions","Utility Functions rgbToHsl light red (#ff8080): l>0.5, s computed via (2-max-min) branch",""
"","1","Frontend Unit Tests i18n Configuration should have defined resources for en, es, el","","Sat Apr 25 09:18:15 UTC 2026","passed","Sat Apr 25 09:18:15 UTC 2026","","Frontend Unit Tests","Frontend Unit Tests i18n Configuration should have defined resources for en, es, el",""
"","6","Frontend Unit Tests App Component initial default background before fetch resolves","","Sat Apr 25 09:18:14 UTC 2026","passed","Sat Apr 25 09:18:14 UTC 2026","","Frontend Unit Tests","Frontend Unit Tests App Component initial default background before fetch resolves",""
"","936","verify Red ( #e74c3c ) is applied as the background color","Chrome","Sat Apr 25 09:22:25 UTC 2026","passed","Sat Apr 25 09:22:26 UTC 2026","POM Refactored: Background color tests","tests/pom-refactored.spec.ts","",""
"","30","Frontend Unit Tests App Component add color 409 conflict shows picker error (data.error message)","","Sat Apr 25 09:18:14 UTC 2026","passed","Sat Apr 25 09:18:14 UTC 2026","","Frontend Unit Tests","Frontend Unit Tests App Component add color 409 conflict shows picker error (data.error message)",""
"","30","Frontend Unit Tests App Component clicking chip-x opens confirm dialog with color name and swatch","","Sat Apr 25 09:18:14 UTC 2026","passed","Sat Apr 25 09:18:14 UTC 2026","","Frontend Unit Tests","Frontend Unit Tests App Component clicking chip-x opens confirm dialog with color name and swatch",""
"","1878","should maintain accessibility in el language and verify resilient locators","Chrome","Sat Apr 25 09:22:47 UTC 2026","passed","Sat Apr 25 09:22:49 UTC 2026","i18n Accessibility Tests","tests/a11y.spec.ts","",""
"","58","Frontend Unit Tests App Component add color success closes picker and shows new chip","","Sat Apr 25 09:18:14 UTC 2026","passed","Sat Apr 25 09:18:14 UTC 2026","","Frontend Unit Tests","Frontend Unit Tests App Component add color success closes picker and shows new chip",""
"","603","homepage should match snapshot","Chrome","Sat Apr 25 09:24:41 UTC 2026","passed","Sat Apr 25 09:24:41 UTC 2026","Visual Regression – iphone-se (375×667)","","",""
"","8","Server Unit Tests GET /api/colors/:name returns a single color by name with correct fields","","Sat Apr 25 09:18:02 UTC 2026","passed","Sat Apr 25 09:18:02 UTC 2026","","Server Unit Tests","Server Unit Tests GET /api/colors/:name returns a single color by name with correct fields",""
"","29","Component Tests ConfirmDialog both buttons are disabled when busy=true","","Sat Apr 25 09:18:14 UTC 2026","passed","Sat Apr 25 09:18:14 UTC 2026","","Component Tests","Component Tests ConfirmDialog both buttons are disabled when busy=true",""
"","0","Utility Functions readableOn returns #111 for light-grey (L≈0.60, above 0.179 threshold)","","Sat Apr 25 09:18:14 UTC 2026","passed","Sat Apr 25 09:18:14 UTC 2026","","Utility Functions","Utility Functions readableOn returns #111 for light-grey (L≈0.60, above 0.179 threshold)",""
"","11","Component Tests ColorPicker renders the color wheel canvas","","Sat Apr 25 09:18:14 UTC 2026","passed","Sat Apr 25 09:18:14 UTC 2026","","Utility Functions","Component Tests ColorPicker renders the color wheel canvas",""
"","39","Frontend Unit Tests App Component add color 501 also triggers server error message (>= 500)","","Sat Apr 25 09:18:14 UTC 2026","passed","Sat Apr 25 09:18:14 UTC 2026","","Frontend Unit Tests","Frontend Unit Tests App Component add color 501 also triggers server error message (>= 500)",""
"","4","Server Unit Tests Error Handling GET /api/colors returns 500 when database fails","","Sat Apr 25 09:18:02 UTC 2026","passed","Sat Apr 25 09:18:02 UTC 2026","","Server Unit Tests","Server Unit Tests Error Handling GET /api/colors returns 500 when database fails",""
"","15","Server Unit Tests GET /api/colors returns an empty array when no colors exist","","Sat Apr 25 09:18:02 UTC 2026","passed","Sat Apr 25 09:18:02 UTC 2026","","Server Unit Tests","Server Unit Tests GET /api/colors returns an empty array when no colors exist",""
"","12","Server Integration Tests (Testcontainers) Concurrent writes should handle parallel GETs without errors","","Sat Apr 25 09:18:02 UTC 2026","passed","Sat Apr 25 09:18:02 UTC 2026","","Server Integration Tests (Testcontainers)","Server Integration Tests (Testcontainers) Concurrent writes should handle parallel GETs without errors",""
"","8","Server Integration Tests (Testcontainers) DELETE /api/colors/:name should return 404 on a second delete of the same color","","Sat Apr 25 09:18:02 UTC 2026","passed","Sat Apr 25 09:18:02 UTC 2026","","Server Integration Tests (Testcontainers)","Server Integration Tests (Testcontainers) DELETE /api/colors/:name should return 404 on a second delete of the same color",""
"","31","Frontend Unit Tests App Component confirm dialog Escape key closes it","","Sat Apr 25 09:18:14 UTC 2026","passed","Sat Apr 25 09:18:14 UTC 2026","","Frontend Unit Tests","Frontend Unit Tests App Component confirm dialog Escape key closes it",""
"","3277","should maintain accessibility after state change (color update)","Chrome","Sat Apr 25 09:22:38 UTC 2026","passed","Sat Apr 25 09:22:41 UTC 2026","Accessibility Tests","tests/a11y.spec.ts","",""
"","9","Server Integration Tests (Testcontainers) POST /api/colors should accept a single alphanumeric character as a name","","Sat Apr 25 09:18:02 UTC 2026","passed","Sat Apr 25 09:18:02 UTC 2026","","Server Integration Tests (Testcontainers)","Server Integration Tests (Testcontainers) POST /api/colors should accept a single alphanumeric character as a name",""
"","6","PATCH /api/colors/:name returns 405","Chrome","Sat Apr 25 09:22:15 UTC 2026","passed","Sat Apr 25 09:22:15 UTC 2026","Security > HTTP Method Restrictions","tests/security.spec.ts","",""
"","11","Server Integration Tests (Testcontainers) PUT /api/colors/:name should update both name and hex simultaneously","","Sat Apr 25 09:18:02 UTC 2026","passed","Sat Apr 25 09:18:02 UTC 2026","","Server Integration Tests (Testcontainers)","Server Integration Tests (Testcontainers) PUT /api/colors/:name should update both name and hex simultaneously",""
"","667","handle initial fetch with empty data","Chrome","Sat Apr 25 09:22:20 UTC 2026","passed","Sat Apr 25 09:22:20 UTC 2026","Edge cases and error handling","tests/coverage.spec.ts","",""
"","683","handle color selection fetch error","Chrome","Sat Apr 25 09:22:20 UTC 2026","passed","Sat Apr 25 09:22:20 UTC 2026","Edge cases and error handling","tests/coverage.spec.ts","",""
"","4","Server Unit Tests Error Handling GET /api/colors/:name returns 500 when database fails","","Sat Apr 25 09:18:02 UTC 2026","passed","Sat Apr 25 09:18:02 UTC 2026","","Server Unit Tests","Server Unit Tests Error Handling GET /api/colors/:name returns 500 when database fails",""
"","1112","should display all core elements and handle button interaction","Chrome","Sat Apr 25 09:24:42 UTC 2026","passed","Sat Apr 25 09:24:43 UTC 2026","Responsive Design – iPhone SE (375×667)","","",""
"","19","Server Integration Tests (Testcontainers) GET /api/colors/:name should return correct data for Red","","Sat Apr 25 09:18:02 UTC 2026","passed","Sat Apr 25 09:18:02 UTC 2026","","Server Integration Tests (Testcontainers)","Server Integration Tests (Testcontainers) GET /api/colors/:name should return correct data for Red",""
"","40","Frontend Unit Tests App Component add color 400 shows data.error message","","Sat Apr 25 09:18:14 UTC 2026","passed","Sat Apr 25 09:18:14 UTC 2026","","Frontend Unit Tests","Frontend Unit Tests App Component add color 400 shows data.error message",""
"","28","should return 409 for duplicate color creation","Chrome","Sat Apr 25 09:22:49 UTC 2026","passed","Sat Apr 25 09:22:49 UTC 2026","Backend API Integration > POST /api/colors Schema Validation","tests/api.spec.ts","",""
"","1","Utility Functions rgbToHsl b max (#0040ff) → h in (180,300)","","Sat Apr 25 09:18:14 UTC 2026","passed","Sat Apr 25 09:18:14 UTC 2026","","Utility Functions","Utility Functions rgbToHsl b max (#0040ff) → h in (180,300)",""
"","1337","color names rendered in the UI do not trigger script execution","Chrome","Sat Apr 25 09:22:13 UTC 2026","passed","Sat Apr 25 09:22:14 UTC 2026","Security > XSS Prevention","tests/security.spec.ts","",""
"","972","DELETE /api/colors/{name}","","","passed","","","schemathesis","",""
"","66","Frontend Unit Tests App Component handles empty array from initial fetch gracefully","","Sat Apr 25 09:18:14 UTC 2026","passed","Sat Apr 25 09:18:14 UTC 2026","","Frontend Unit Tests","Frontend Unit Tests App Component handles empty array from initial fetch gracefully",""
"","9","Frontend Unit Tests App Component shows error alert when initial fetch fails","","Sat Apr 25 09:18:14 UTC 2026","passed","Sat Apr 25 09:18:14 UTC 2026","","Frontend Unit Tests","Frontend Unit Tests App Component shows error alert when initial fetch fails",""
"","66","Frontend Unit Tests App Component handles null data from initial fetch gracefully","","Sat Apr 25 09:18:14 UTC 2026","passed","Sat Apr 25 09:18:14 UTC 2026","","Frontend Unit Tests","Frontend Unit Tests App Component handles null data from initial fetch gracefully",""
"","65","Frontend Unit Tests App Component fetches and displays color chips with swatch and delete button","","Sat Apr 25 09:18:14 UTC 2026","passed","Sat Apr 25 09:18:14 UTC 2026","","Frontend Unit Tests","Frontend Unit Tests App Component fetches and displays color chips with swatch and delete button",""
"","26","Frontend Unit Tests App Component labelFor returns translation for known color (Turquoise)","","Sat Apr 25 09:18:14 UTC 2026","passed","Sat Apr 25 09:18:14 UTC 2026","","Frontend Unit Tests","Frontend Unit Tests App Component labelFor returns translation for known color (Turquoise)",""
"","10","Server Unit Tests GET /api/colors does not expose _id or __v fields","","Sat Apr 25 09:18:02 UTC 2026","passed","Sat Apr 25 09:18:02 UTC 2026","","Server Unit Tests","Server Unit Tests GET /api/colors does not expose _id or __v fields",""
"","7","Component Tests ColorPicker falls back to window resize listener when ResizeObserver is not available","","Sat Apr 25 09:18:14 UTC 2026","passed","Sat Apr 25 09:18:14 UTC 2026","","Utility Functions","Component Tests ColorPicker falls back to window resize listener when ResizeObserver is not available",""
"","10","Server Integration Tests (Testcontainers) POST /api/colors should return 409 when creating a duplicate color name","","Sat Apr 25 09:18:02 UTC 2026","passed","Sat Apr 25 09:18:02 UTC 2026","","Server Integration Tests (Testcontainers)","Server Integration Tests (Testcontainers) POST /api/colors should return 409 when creating a duplicate color name",""
"","0","Utility Functions rgbToHsl pure green → h=120, s=1, l=0.5","","Sat Apr 25 09:18:14 UTC 2026","passed","Sat Apr 25 09:18:14 UTC 2026","","Utility Functions","Utility Functions rgbToHsl pure green → h=120, s=1, l=0.5",""
"","1","Utility Functions rgbToHsl r max with g<b (#ff0040) → h near 345","","Sat Apr 25 09:18:14 UTC 2026","passed","Sat Apr 25 09:18:14 UTC 2026","","Utility Functions","Utility Functions rgbToHsl r max with g<b (#ff0040) → h near 345",""
"","23","Component Tests ColorPicker lightness slider change updates the preview","","Sat Apr 25 09:18:14 UTC 2026","passed","Sat Apr 25 09:18:14 UTC 2026","","Utility Functions","Component Tests ColorPicker lightness slider change updates the preview",""
"","987","clicking a chip makes it active","Chrome","Sat Apr 25 09:22:22 UTC 2026","passed","Sat Apr 25 09:22:23 UTC 2026","Color Management — Add & Delete","tests/color-management.spec.ts","",""
"","36","Frontend Unit Tests App Component add color 400 without data.error falls back to generic message","","Sat Apr 25 09:18:14 UTC 2026","passed","Sat Apr 25 09:18:14 UTC 2026","","Frontend Unit Tests","Frontend Unit Tests App Component add color 400 without data.error falls back to generic message",""
"","6","Server Integration Tests (Testcontainers) Method Not Allowed should return 405 for PATCH /api/colors","","Sat Apr 25 09:18:02 UTC 2026","passed","Sat Apr 25 09:18:02 UTC 2026","","Server Integration Tests (Testcontainers)","Server Integration Tests (Testcontainers) Method Not Allowed should return 405 for PATCH /api/colors",""
"","1","Utility Functions hslToRgb hue just below 60 is in sector 0, not sector 1","","Sat Apr 25 09:18:14 UTC 2026","passed","Sat Apr 25 09:18:14 UTC 2026","","Utility Functions","Utility Functions hslToRgb hue just below 60 is in sector 0, not sector 1",""
"","4","Server Unit Tests Middleware returns 413 for payload too large","","Sat Apr 25 09:18:02 UTC 2026","passed","Sat Apr 25 09:18:02 UTC 2026","","Server Unit Tests","Server Unit Tests Middleware returns 413 for payload too large",""
"","0","Utility Functions rgbToHex pads single-digit hex values with leading zero","","Sat Apr 25 09:18:14 UTC 2026","passed","Sat Apr 25 09:18:14 UTC 2026","","Utility Functions","Utility Functions rgbToHex pads single-digit hex values with leading zero",""
"","22","Component Tests ColorPicker submit is blocked when hex input has an error","","Sat Apr 25 09:18:14 UTC 2026","passed","Sat Apr 25 09:18:14 UTC 2026","","Utility Functions","Component Tests ColorPicker submit is blocked when hex input has an error",""
"","0","homepage after color change","Chrome","Sat Apr 25 09:24:43 UTC 2026","skipped","Sat Apr 25 09:24:43 UTC 2026","Percy Visual Regression – Production > Percy – mobile (375×667)","","",""
"","4","Server Unit Tests POST /api/colors returns 400 for invalid hex format (no hash)","","Sat Apr 25 09:18:02 UTC 2026","passed","Sat Apr 25 09:18:02 UTC 2026","","Server Unit Tests","Server Unit Tests POST /api/colors returns 400 for invalid hex format (no hash)",""
"","650","Background stays unchanged when fetching a specific color fails","BDD","Sat Apr 25 09:22:35 UTC 2026","passed","Sat Apr 25 09:22:35 UTC 2026","API Error Handling","","",""
"","6","Server Unit Tests 405 Method Not Allowed does not return 405 for allowed PUT method on /api/colors/:name","","Sat Apr 25 09:18:02 UTC 2026","passed","Sat Apr 25 09:18:02 UTC 2026","","Server Unit Tests","Server Unit Tests 405 Method Not Allowed does not return 405 for allowed PUT method on /api/colors/:name",""
"","24","Component Tests ConfirmDialog confirm button calls onConfirm","","Sat Apr 25 09:18:14 UTC 2026","passed","Sat Apr 25 09:18:14 UTC 2026","","Component Tests","Component Tests ConfirmDialog confirm button calls onConfirm",""
"","10","Component Tests ColorPicker wheel cursor is at (110,110) at center (sat=0)","","Sat Apr 25 09:18:14 UTC 2026","passed","Sat Apr 25 09:18:14 UTC 2026","","Utility Functions","Component Tests ColorPicker wheel cursor is at (110,110) at center (sat=0)",""
"","0","Utility Functions hslToRgb hue=240 (blue) → [0,0,255]","","Sat Apr 25 09:18:14 UTC 2026","passed","Sat Apr 25 09:18:14 UTC 2026","","Utility Functions","Utility Functions hslToRgb hue=240 (blue) → [0,0,255]",""
"","4","Server Unit Tests Middleware includes CORS headers","","Sat Apr 25 09:18:02 UTC 2026","passed","Sat Apr 25 09:18:02 UTC 2026","","Server Unit Tests","Server Unit Tests Middleware includes CORS headers",""
"","1197","successful delete removes the chip","Chrome","Sat Apr 25 09:22:29 UTC 2026","passed","Sat Apr 25 09:22:30 UTC 2026","Color Management — Add & Delete","tests/color-management.spec.ts","",""
"","4","Server Unit Tests 405 Method Not Allowed returns 405 for PATCH on /api/colors/:name","","Sat Apr 25 09:18:02 UTC 2026","passed","Sat Apr 25 09:18:02 UTC 2026","","Server Unit Tests","Server Unit Tests 405 Method Not Allowed returns 405 for PATCH on /api/colors/:name",""
"","12","should reject invalid hex format","Chrome","Sat Apr 25 09:22:50 UTC 2026","passed","Sat Apr 25 09:22:50 UTC 2026","Backend API Integration > POST /api/colors Schema Validation","tests/api.spec.ts","",""
"","1","Utility Functions paintWheelPixel wraps negative angle: dy<0 gives angle+360 (hue=270 → violet)","","Sat Apr 25 09:18:14 UTC 2026","passed","Sat Apr 25 09:18:14 UTC 2026","","Utility Functions","Utility Functions paintWheelPixel wraps negative angle: dy<0 gives angle+360 (hue=270 → violet)",""
"","48","GET /api/colors/Turquoise should return the correct hex code","Chrome","Sat Apr 25 09:22:49 UTC 2026","passed","Sat Apr 25 09:22:49 UTC 2026","Backend API Integration","tests/api.spec.ts","",""
"","25","Frontend Unit Tests App Component clicking Add color button opens picker modal","","Sat Apr 25 09:18:14 UTC 2026","passed","Sat Apr 25 09:18:14 UTC 2026","","Frontend Unit Tests","Frontend Unit Tests App Component clicking Add color button opens picker modal",""
"","4","Server Unit Tests PUT /api/colors/:name returns 400 for extra unknown fields (strict schema)","","Sat Apr 25 09:18:02 UTC 2026","passed","Sat Apr 25 09:18:02 UTC 2026","","Server Unit Tests","Server Unit Tests PUT /api/colors/:name returns 400 for extra unknown fields (strict schema)",""
"","5","Server Integration Tests (Testcontainers) PUT /api/colors/:name should return 400 when update body is empty","","Sat Apr 25 09:18:02 UTC 2026","passed","Sat Apr 25 09:18:02 UTC 2026","","Server Integration Tests (Testcontainers)","Server Integration Tests (Testcontainers) PUT /api/colors/:name should return 400 when update body is empty",""
"","4","Server Unit Tests DELETE /api/colors/:name returns 400 for invalid name in path (regex check)","","Sat Apr 25 09:18:02 UTC 2026","passed","Sat Apr 25 09:18:02 UTC 2026","","Server Unit Tests","Server Unit Tests DELETE /api/colors/:name returns 400 for invalid name in path (regex check)",""
"","3","Server Unit Tests Surviving Mutants & Edge Cases Swagger Metadata & OpenAPI has exact application/json content-type","","Sat Apr 25 09:18:02 UTC 2026","passed","Sat Apr 25 09:18:02 UTC 2026","","Server Unit Tests","Server Unit Tests Surviving Mutants & Edge Cases Swagger Metadata & OpenAPI has exact application/json content-type",""
"","5","Server Unit Tests Surviving Mutants & Edge Cases Rate Limiting & Security kills mutants by verifying x-ratelimit headers","","Sat Apr 25 09:18:02 UTC 2026","passed","Sat Apr 25 09:18:02 UTC 2026","","Server Unit Tests","Server Unit Tests Surviving Mutants & Edge Cases Rate Limiting & Security kills mutants by verifying x-ratelimit headers",""
"","648","should gracefully handle a color not found in the database","Chrome","Sat Apr 25 09:22:25 UTC 2026","passed","Sat Apr 25 09:22:25 UTC 2026","Network Mocking & Interception","tests/network-mocking.spec.ts","",""
"","1","Utility Functions readableOn returns #111 for white (very light, L=1)","","Sat Apr 25 09:18:14 UTC 2026","passed","Sat Apr 25 09:18:14 UTC 2026","","Utility Functions","Utility Functions readableOn returns #111 for white (very light, L=1)",""
"","3","Server Unit Tests 405 Method Not Allowed returns 405 for PATCH on /api/colors","","Sat Apr 25 09:18:02 UTC 2026","passed","Sat Apr 25 09:18:02 UTC 2026","","Server Unit Tests","Server Unit Tests 405 Method Not Allowed returns 405 for PATCH on /api/colors",""
"","10","Server Integration Tests (Testcontainers) GET /api/colors/:name should return correct data for Yellow","","Sat Apr 25 09:18:02 UTC 2026","passed","Sat Apr 25 09:18:02 UTC 2026","","Server Integration Tests (Testcontainers)","Server Integration Tests (Testcontainers) GET /api/colors/:name should return correct data for Yellow",""
"","78","Frontend Unit Tests App Component confirm dialog cancel does nothing when deleting=true","","Sat Apr 25 09:18:14 UTC 2026","passed","Sat Apr 25 09:18:14 UTC 2026","","Frontend Unit Tests","Frontend Unit Tests App Component confirm dialog cancel does nothing when deleting=true",""
"","3","Server Unit Tests Middleware handles non-JSON content type gracefully on POST","","Sat Apr 25 09:18:02 UTC 2026","passed","Sat Apr 25 09:18:02 UTC 2026","","Server Unit Tests","Server Unit Tests Middleware handles non-JSON content type gracefully on POST",""
"","19","Server Integration Tests (Testcontainers) seedDatabase should clear custom colors when re-seeded","","Sat Apr 25 09:18:02 UTC 2026","passed","Sat Apr 25 09:18:02 UTC 2026","","Server Integration Tests (Testcontainers)","Server Integration Tests (Testcontainers) seedDatabase should clear custom colors when re-seeded",""
"","0","Utility Functions readableOn returns #111 for mid-grey (L≈0.35, black gives better contrast)","","Sat Apr 25 09:18:14 UTC 2026","passed","Sat Apr 25 09:18:14 UTC 2026","","Utility Functions","Utility Functions readableOn returns #111 for mid-grey (L≈0.35, black gives better contrast)",""
"","0","Utility Functions hslToRgb hue=300 (magenta) → [255,0,255]","","Sat Apr 25 09:18:14 UTC 2026","passed","Sat Apr 25 09:18:14 UTC 2026","","Utility Functions","Utility Functions hslToRgb hue=300 (magenta) → [255,0,255]",""
"","687","handle initial fetch error","Chrome","Sat Apr 25 09:22:19 UTC 2026","passed","Sat Apr 25 09:22:20 UTC 2026","Edge cases and error handling","tests/coverage.spec.ts","",""
"","0","Utility Functions readableOn returns #111 for turquoise (L≈0.39, black gives better contrast)","","Sat Apr 25 09:18:14 UTC 2026","passed","Sat Apr 25 09:18:14 UTC 2026","","Utility Functions","Utility Functions readableOn returns #111 for turquoise (L≈0.39, black gives better contrast)",""
"","8","Server Integration Tests (Testcontainers) GET /api/colors/:name should return 400 for invalid name format","","Sat Apr 25 09:18:02 UTC 2026","passed","Sat Apr 25 09:18:02 UTC 2026","","Server Integration Tests (Testcontainers)","Server Integration Tests (Testcontainers) GET /api/colors/:name should return 400 for invalid name format",""
"","6","Server Unit Tests DELETE /api/colors/:name cannot delete the same color twice","","Sat Apr 25 09:18:02 UTC 2026","passed","Sat Apr 25 09:18:02 UTC 2026","","Server Unit Tests","Server Unit Tests DELETE /api/colors/:name cannot delete the same color twice",""
