"DESCRIPTION","DURATION IN MS","NAME","PARENT SUITE","START TIME","STATUS","STOP TIME","SUB SUITE","SUITE","TEST CLASS","TEST METHOD"
"","45","GET /api/colors/Yellow should return the correct hex code","Chrome","Sat Mar 07 18:38:30 UTC 2026","passed","Sat Mar 07 18:38:30 UTC 2026","Backend API Integration","tests/api.spec.ts","",""
"","979","should handle missing image gracefully by showing alt text","Chrome","Sat Mar 07 18:38:14 UTC 2026","passed","Sat Mar 07 18:38:15 UTC 2026","Network Mocking & Interception","tests/network-mocking.spec.ts","",""
"","1059","should maintain accessibility in es language and verify resilient locators","Chrome","Sat Mar 07 18:38:34 UTC 2026","passed","Sat Mar 07 18:38:35 UTC 2026","i18n Accessibility Tests","tests/a11y.spec.ts","",""
"","26","should reject missing hex","Chrome","Sat Mar 07 18:38:30 UTC 2026","passed","Sat Mar 07 18:38:30 UTC 2026","Backend API Integration > POST /api/colors Schema Validation","tests/api.spec.ts","",""
"","1360","should create color via API and verify through UI","Chrome","Sat Mar 07 18:38:14 UTC 2026","passed","Sat Mar 07 18:38:15 UTC 2026","Hybrid E2E Testing","tests/hybrid.spec.ts","",""
"","812","changing color to Turquoise should reflect in UI and DOM","Chrome","Sat Mar 07 18:38:11 UTC 2026","passed","Sat Mar 07 18:38:12 UTC 2026","Data-Driven Testing","tests/data-driven.spec.ts","",""
"","857","changing color to Yellow should reflect in UI and DOM","Chrome","Sat Mar 07 18:38:13 UTC 2026","passed","Sat Mar 07 18:38:14 UTC 2026","Data-Driven Testing","tests/data-driven.spec.ts","",""
"","8078","should load the application and verify core functionality across browsers","WebKit","Sat Mar 07 18:38:14 UTC 2026","passed","Sat Mar 07 18:38:22 UTC 2026","Cross-Browser Core Functionality","tests/cross-browser.spec.ts","",""
"","881","verify Yellow ( #f1c40f ) is applied as the background color","Chrome","Sat Mar 07 18:38:17 UTC 2026","passed","Sat Mar 07 18:38:18 UTC 2026","POM Refactored: Background color tests","tests/pom-refactored.spec.ts","",""
"","572","Example #1","BDD","Sat Mar 07 18:38:09 UTC 2026","passed","Sat Mar 07 18:38:09 UTC 2026","Home Page Background Color > Change background color","../.features-gen/e2e/features/home.feature.spec.js","",""
"","783","verify Turquoise ( #1abc9c ) is applied as the background color","Chrome","Sat Mar 07 18:38:16 UTC 2026","passed","Sat Mar 07 18:38:16 UTC 2026","POM Refactored: Background color tests","tests/pom-refactored.spec.ts","",""
"","124","GET /api/colors/Turquoise should return the correct hex code","Chrome","Sat Mar 07 18:38:30 UTC 2026","passed","Sat Mar 07 18:38:30 UTC 2026","Backend API Integration","tests/api.spec.ts","",""
"","831","verify Turquoise ( #1abc9c ) is applied as the background color","Chrome","Sat Mar 07 18:38:11 UTC 2026","passed","Sat Mar 07 18:38:12 UTC 2026","Background color tests","tests/coverage.spec.ts","",""
"","76","should update a color with valid schema","Chrome","Sat Mar 07 18:38:30 UTC 2026","passed","Sat Mar 07 18:38:31 UTC 2026","Backend API Integration > PUT /api/colors/:name Schema Validation","tests/api.spec.ts","",""
"","675","homepage should match snapshot","Chrome","Sat Mar 07 18:39:02 UTC 2026","passed","Sat Mar 07 18:39:02 UTC 2026","Visual Regression","tests/visual.spec.ts","",""
"","35","should reject invalid hex format on update","Chrome","Sat Mar 07 18:38:31 UTC 2026","passed","Sat Mar 07 18:38:31 UTC 2026","Backend API Integration > PUT /api/colors/:name Schema Validation","tests/api.spec.ts","",""
"","827","verify Red ( #e74c3c ) is applied as the background color","Chrome","Sat Mar 07 18:38:16 UTC 2026","passed","Sat Mar 07 18:38:17 UTC 2026","POM Refactored: Background color tests","tests/pom-refactored.spec.ts","",""
"","141","should reject omitting both name and hex on update","Chrome","Sat Mar 07 18:38:31 UTC 2026","passed","Sat Mar 07 18:38:31 UTC 2026","Backend API Integration > PUT /api/colors/:name Schema Validation","tests/api.spec.ts","",""
"","374","Example #3","BDD","Sat Mar 07 18:38:10 UTC 2026","passed","Sat Mar 07 18:38:10 UTC 2026","Home Page Background Color > Change background color","../.features-gen/e2e/features/home.feature.spec.js","",""
"","1014","should maintain accessibility in el language and verify resilient locators","Chrome","Sat Mar 07 18:38:35 UTC 2026","passed","Sat Mar 07 18:38:36 UTC 2026","i18n Accessibility Tests","tests/a11y.spec.ts","",""
"","35","should reject empty name","Chrome","Sat Mar 07 18:38:30 UTC 2026","passed","Sat Mar 07 18:38:30 UTC 2026","Backend API Integration > POST /api/colors Schema Validation","tests/api.spec.ts","",""
"","877","should gracefully handle a color not found in the database","Chrome","Sat Mar 07 18:38:16 UTC 2026","passed","Sat Mar 07 18:38:17 UTC 2026","Network Mocking & Interception","tests/network-mocking.spec.ts","",""
"","831","verify Red ( #e74c3c ) is applied as the background color","Chrome","Sat Mar 07 18:38:12 UTC 2026","passed","Sat Mar 07 18:38:13 UTC 2026","Background color tests","tests/coverage.spec.ts","",""
"","976","should display colors that do not exist in the database","Chrome","Sat Mar 07 18:38:15 UTC 2026","passed","Sat Mar 07 18:38:16 UTC 2026","Network Mocking & Interception","tests/network-mocking.spec.ts","",""
"","1738","should not have any automatically detectable accessibility issues","Chrome","Sat Mar 07 18:38:30 UTC 2026","passed","Sat Mar 07 18:38:32 UTC 2026","Accessibility Tests","tests/a11y.spec.ts","",""
"","786","should create dynamic random color via API and verify through UI","Chrome","Sat Mar 07 18:38:17 UTC 2026","passed","Sat Mar 07 18:38:18 UTC 2026","Random Data Testing with faker.js","tests/random-data.spec.ts","",""
"","94","should create a new color with valid schema","Chrome","Sat Mar 07 18:38:30 UTC 2026","passed","Sat Mar 07 18:38:30 UTC 2026","Backend API Integration > POST /api/colors Schema Validation","tests/api.spec.ts","",""
"","996","changing color to Red should reflect in UI and DOM","Chrome","Sat Mar 07 18:38:12 UTC 2026","passed","Sat Mar 07 18:38:13 UTC 2026","Data-Driven Testing","tests/data-driven.spec.ts","",""
"","1024","should maintain accessibility in en language and verify resilient locators","Chrome","Sat Mar 07 18:38:33 UTC 2026","passed","Sat Mar 07 18:38:34 UTC 2026","i18n Accessibility Tests","tests/a11y.spec.ts","",""
"","43","should reject updating with empty name","Chrome","Sat Mar 07 18:38:31 UTC 2026","passed","Sat Mar 07 18:38:31 UTC 2026","Backend API Integration > PUT /api/colors/:name Schema Validation","tests/api.spec.ts","",""
"","1408","should maintain accessibility after state change (color update)","Chrome","Sat Mar 07 18:38:32 UTC 2026","passed","Sat Mar 07 18:38:33 UTC 2026","Accessibility Tests","tests/a11y.spec.ts","",""
"","889","check Turquoise ( #1abc9c) is the default background color.","Chrome","Sat Mar 07 18:38:10 UTC 2026","passed","Sat Mar 07 18:38:11 UTC 2026","","tests/coverage.spec.ts","",""
"","1083","verify Yellow ( #f1c40f ) is applied as the background color","Chrome","Sat Mar 07 18:38:13 UTC 2026","passed","Sat Mar 07 18:38:14 UTC 2026","Background color tests","tests/coverage.spec.ts","",""
"","27","should reject missing name","Chrome","Sat Mar 07 18:38:30 UTC 2026","passed","Sat Mar 07 18:38:30 UTC 2026","Backend API Integration > POST /api/colors Schema Validation","tests/api.spec.ts","",""
"","39","should reject invalid hex format","Chrome","Sat Mar 07 18:38:30 UTC 2026","passed","Sat Mar 07 18:38:30 UTC 2026","Backend API Integration > POST /api/colors Schema Validation","tests/api.spec.ts","",""
"","482","should render correctly on mobile viewport","Chrome","Sat Mar 07 18:39:02 UTC 2026","passed","Sat Mar 07 18:39:03 UTC 2026","Responsive Design Testing","tests/visual.spec.ts","",""
"","1863","should load the application and verify core functionality across browsers","Firefox","Sat Mar 07 18:38:12 UTC 2026","passed","Sat Mar 07 18:38:14 UTC 2026","Cross-Browser Core Functionality","tests/cross-browser.spec.ts","",""
"","459","should load the application and verify core functionality across browsers","Chrome","Sat Mar 07 18:38:16 UTC 2026","passed","Sat Mar 07 18:38:17 UTC 2026","Cross-Browser Core Functionality","tests/cross-browser.spec.ts","",""
"","438","Example #2","BDD","Sat Mar 07 18:38:09 UTC 2026","passed","Sat Mar 07 18:38:10 UTC 2026","Home Page Background Color > Change background color","../.features-gen/e2e/features/home.feature.spec.js","",""
"","44","GET /api/colors/Red should return the correct hex code","Chrome","Sat Mar 07 18:38:30 UTC 2026","passed","Sat Mar 07 18:38:30 UTC 2026","Backend API Integration","tests/api.spec.ts","",""
