"DESCRIPTION","DURATION IN MS","NAME","PARENT SUITE","START TIME","STATUS","STOP TIME","SUB SUITE","SUITE","TEST CLASS","TEST METHOD"
"","0","Utility Functions paintWheelPixel paints grey at center (dx=0, dy=0, dist=0, sat=0)","","Mon Apr 20 09:40:07 UTC 2026","passed","Mon Apr 20 09:40:07 UTC 2026","","Utility Functions","Utility Functions paintWheelPixel paints grey at center (dx=0, dy=0, dist=0, sat=0)",""
"","606","Example #1","BDD","Mon Apr 20 09:42:52 UTC 2026","passed","Mon Apr 20 09:42:52 UTC 2026","Language Switching > Switch language and verify translated UI labels","","",""
"","9","Server Integration Tests (Testcontainers) POST /api/colors should not expose _id or __v in the creation response","","Mon Apr 20 09:39:53 UTC 2026","passed","Mon Apr 20 09:39:53 UTC 2026","","Server Integration Tests (Testcontainers)","Server Integration Tests (Testcontainers) POST /api/colors should not expose _id or __v in the creation response",""
"","1","Utility Functions hslToRgb hue=210 (azure) → [0,128,255]","","Mon Apr 20 09:40:07 UTC 2026","passed","Mon Apr 20 09:40:07 UTC 2026","","Utility Functions","Utility Functions hslToRgb hue=210 (azure) → [0,128,255]",""
"","35","Component Tests ColorPicker mousemove while dragging updates hex (dragging.current=true kills mutation)","","Mon Apr 20 09:40:07 UTC 2026","passed","Mon Apr 20 09:40:07 UTC 2026","","Utility Functions","Component Tests ColorPicker mousemove while dragging updates hex (dragging.current=true kills mutation)",""
"","6","Server Unit Tests DELETE /api/colors/:name cannot delete the same color twice","","Mon Apr 20 09:39:52 UTC 2026","passed","Mon Apr 20 09:39:52 UTC 2026","","Server Unit Tests","Server Unit Tests DELETE /api/colors/:name cannot delete the same color twice",""
"","25","Frontend Unit Tests App Component text color on light background is dark","","Mon Apr 20 09:40:07 UTC 2026","passed","Mon Apr 20 09:40:07 UTC 2026","","Frontend Unit Tests","Frontend Unit Tests App Component text color on light background is dark",""
"","5","Server Integration Tests (Testcontainers) POST /api/colors should return 400 when hex is missing","","Mon Apr 20 09:39:53 UTC 2026","passed","Mon Apr 20 09:39:53 UTC 2026","","Server Integration Tests (Testcontainers)","Server Integration Tests (Testcontainers) POST /api/colors should return 400 when hex is missing",""
"","18","Component Tests ColorPicker mousemove without prior mousedown (not dragging) does not change color","","Mon Apr 20 09:40:07 UTC 2026","passed","Mon Apr 20 09:40:07 UTC 2026","","Utility Functions","Component Tests ColorPicker mousemove without prior mousedown (not dragging) does not change color",""
"","4","Server Unit Tests PUT /api/colors/:name returns 400 for invalid hex on update","","Mon Apr 20 09:39:52 UTC 2026","passed","Mon Apr 20 09:39:52 UTC 2026","","Server Unit Tests","Server Unit Tests PUT /api/colors/:name returns 400 for invalid hex on update",""
"","32","GET /api/colors","","","skipped","","","schemathesis","",""
"","59","Frontend Unit Tests App Component handleColorClick encodes color name in URL","","Mon Apr 20 09:40:07 UTC 2026","passed","Mon Apr 20 09:40:07 UTC 2026","","Frontend Unit Tests","Frontend Unit Tests App Component handleColorClick encodes color name in URL",""
"","1","Utility Functions paintWheelPixel anti-aliases near-edge pixel: dist=r-0.5 gives alpha=127","","Mon Apr 20 09:40:07 UTC 2026","passed","Mon Apr 20 09:40:07 UTC 2026","","Utility Functions","Utility Functions paintWheelPixel anti-aliases near-edge pixel: dist=r-0.5 gives alpha=127",""
"","0","Utility Functions rgbToHex converts pure red","","Mon Apr 20 09:40:07 UTC 2026","passed","Mon Apr 20 09:40:07 UTC 2026","","Utility Functions","Utility Functions rgbToHex converts pure red",""
"","4","Server Unit Tests Surviving Mutants & Edge Cases PUT logic kills hex regex mutant in PUT","","Mon Apr 20 09:39:52 UTC 2026","passed","Mon Apr 20 09:39:52 UTC 2026","","Server Unit Tests","Server Unit Tests Surviving Mutants & Edge Cases PUT logic kills hex regex mutant in PUT",""
"","3","Server Unit Tests 405 Method Not Allowed sets the Allow header on /api/colors with correct methods","","Mon Apr 20 09:39:52 UTC 2026","passed","Mon Apr 20 09:39:52 UTC 2026","","Server Unit Tests","Server Unit Tests 405 Method Not Allowed sets the Allow header on /api/colors with correct methods",""
"","600","homepage should match snapshot","Chrome","Mon Apr 20 09:44:43 UTC 2026","passed","Mon Apr 20 09:44:44 UTC 2026","Visual Regression – iphone-landscape (667×375)","","",""
"","30","Frontend Unit Tests App Component confirm dialog Escape key closes it","","Mon Apr 20 09:40:07 UTC 2026","passed","Mon Apr 20 09:40:07 UTC 2026","","Frontend Unit Tests","Frontend Unit Tests App Component confirm dialog Escape key closes it",""
"","8","Server Unit Tests Error Handling PUT /api/colors/:name returns 500 when database fails","","Mon Apr 20 09:39:52 UTC 2026","passed","Mon Apr 20 09:39:52 UTC 2026","","Server Unit Tests","Server Unit Tests Error Handling PUT /api/colors/:name returns 500 when database fails",""
"","4","Server Unit Tests PUT /api/colors/:name returns 400 for extra unknown fields (strict schema)","","Mon Apr 20 09:39:52 UTC 2026","passed","Mon Apr 20 09:39:52 UTC 2026","","Server Unit Tests","Server Unit Tests PUT /api/colors/:name returns 400 for extra unknown fields (strict schema)",""
"","6","Component Tests ConfirmDialog backdrop click calls onCancel when not busy","","Mon Apr 20 09:40:07 UTC 2026","passed","Mon Apr 20 09:40:07 UTC 2026","","Component Tests","Component Tests ConfirmDialog backdrop click calls onCancel when not busy",""
"","26","Component Tests ColorPicker lightness slider change updates the preview","","Mon Apr 20 09:40:07 UTC 2026","passed","Mon Apr 20 09:40:07 UTC 2026","","Utility Functions","Component Tests ColorPicker lightness slider change updates the preview",""
"","659","should gracefully handle a color not found in the database","Chrome","Mon Apr 20 09:42:51 UTC 2026","passed","Mon Apr 20 09:42:52 UTC 2026","Network Mocking & Interception","tests/network-mocking.spec.ts","",""
"","46","Frontend Unit Tests App Component delete network error shows error alert","","Mon Apr 20 09:40:07 UTC 2026","passed","Mon Apr 20 09:40:07 UTC 2026","","Frontend Unit Tests","Frontend Unit Tests App Component delete network error shows error alert",""
"","7","array body on POST returns 400","Chrome","Mon Apr 20 09:42:47 UTC 2026","passed","Mon Apr 20 09:42:47 UTC 2026","Security > Input Validation","tests/security.spec.ts","",""
"","579","Escape key closes the confirm dialog","Chrome","Mon Apr 20 09:42:43 UTC 2026","passed","Mon Apr 20 09:42:43 UTC 2026","Color Management — Add & Delete","tests/color-management.spec.ts","",""
"","1","Utility Functions hexToRgb parses a standard #RRGGBB hex","","Mon Apr 20 09:40:07 UTC 2026","passed","Mon Apr 20 09:40:07 UTC 2026","","Utility Functions","Utility Functions hexToRgb parses a standard #RRGGBB hex",""
"","0","Utility Functions hslToRgb lightness clamped: l=1.5 gives white","","Mon Apr 20 09:40:07 UTC 2026","passed","Mon Apr 20 09:40:07 UTC 2026","","Utility Functions","Utility Functions hslToRgb lightness clamped: l=1.5 gives white",""
"","110","Frontend Unit Tests App Component handleColorClick does nothing when data is null","","Mon Apr 20 09:40:07 UTC 2026","passed","Mon Apr 20 09:40:07 UTC 2026","","Frontend Unit Tests","Frontend Unit Tests App Component handleColorClick does nothing when data is null",""
"","73","Frontend Unit Tests App Component deleting is false again after a failed delete (finally block)","","Mon Apr 20 09:40:07 UTC 2026","passed","Mon Apr 20 09:40:07 UTC 2026","","Frontend Unit Tests","Frontend Unit Tests App Component deleting is false again after a failed delete (finally block)",""
"","65","Frontend Unit Tests App Component handles null data from initial fetch gracefully","","Mon Apr 20 09:40:07 UTC 2026","passed","Mon Apr 20 09:40:07 UTC 2026","","Frontend Unit Tests","Frontend Unit Tests App Component handles null data from initial fetch gracefully",""
"","4","Server Unit Tests 405 Method Not Allowed does not return 405 for allowed GET method on /api/colors/:name","","Mon Apr 20 09:39:52 UTC 2026","passed","Mon Apr 20 09:39:52 UTC 2026","","Server Unit Tests","Server Unit Tests 405 Method Not Allowed does not return 405 for allowed GET method on /api/colors/:name",""
"","6","Server Unit Tests 405 Method Not Allowed does not return 405 for allowed POST method on /api/colors","","Mon Apr 20 09:39:52 UTC 2026","passed","Mon Apr 20 09:39:52 UTC 2026","","Server Unit Tests","Server Unit Tests 405 Method Not Allowed does not return 405 for allowed POST method on /api/colors",""
"","24","Component Tests ColorPicker touchend stops dragging (touchmove after touchend is ignored)","","Mon Apr 20 09:40:07 UTC 2026","passed","Mon Apr 20 09:40:07 UTC 2026","","Utility Functions","Component Tests ColorPicker touchend stops dragging (touchmove after touchend is ignored)",""
"","976","verify Yellow ( #f1c40f ) is applied as the background color","Chrome","Mon Apr 20 09:42:52 UTC 2026","passed","Mon Apr 20 09:42:53 UTC 2026","POM Refactored: Background color tests","tests/pom-refactored.spec.ts","",""
"","5","Server Unit Tests POST /api/colors returns 400 for extra unknown fields (strict schema)","","Mon Apr 20 09:39:52 UTC 2026","passed","Mon Apr 20 09:39:52 UTC 2026","","Server Unit Tests","Server Unit Tests POST /api/colors returns 400 for extra unknown fields (strict schema)",""
"","1908","PUT /api/colors/{name}","","","passed","","","schemathesis","",""
"","24","Component Tests ColorPicker valid submit calls onConfirm with trimmed name and current hex","","Mon Apr 20 09:40:07 UTC 2026","passed","Mon Apr 20 09:40:07 UTC 2026","","Utility Functions","Component Tests ColorPicker valid submit calls onConfirm with trimmed name and current hex",""
"","944","clicking a chip makes it active","Chrome","Mon Apr 20 09:42:37 UTC 2026","passed","Mon Apr 20 09:42:38 UTC 2026","Color Management — Add & Delete","tests/color-management.spec.ts","",""
"","1311","should create color via API and verify through UI","Chrome","Mon Apr 20 09:42:50 UTC 2026","passed","Mon Apr 20 09:42:51 UTC 2026","Hybrid E2E Testing","tests/hybrid.spec.ts","",""
"","26","Server Unit Tests POST /api/colors creates a new color and returns 201 with correct body","","Mon Apr 20 09:39:52 UTC 2026","passed","Mon Apr 20 09:39:52 UTC 2026","","Server Unit Tests","Server Unit Tests POST /api/colors creates a new color and returns 201 with correct body",""
"","0","Utility Functions hslToRgb hue=180 (cyan) → [0,255,255]","","Mon Apr 20 09:40:07 UTC 2026","passed","Mon Apr 20 09:40:07 UTC 2026","","Utility Functions","Utility Functions hslToRgb hue=180 (cyan) → [0,255,255]",""
"","2156","should maintain accessibility after state change (color update)","Chrome","Mon Apr 20 09:43:19 UTC 2026","passed","Mon Apr 20 09:43:22 UTC 2026","Accessibility Tests","tests/a11y.spec.ts","",""
"","0","Utility Functions rgbToHsl b max (#0040ff) → h in (180,300)","","Mon Apr 20 09:40:07 UTC 2026","passed","Mon Apr 20 09:40:07 UTC 2026","","Utility Functions","Utility Functions rgbToHsl b max (#0040ff) → h in (180,300)",""
"","8","Frontend Unit Tests App Component colors.length === 0 shows loading text","","Mon Apr 20 09:40:07 UTC 2026","passed","Mon Apr 20 09:40:07 UTC 2026","","Frontend Unit Tests","Frontend Unit Tests App Component colors.length === 0 shows loading text",""
"","593","should handle fetch colors network failure gracefully","Chrome","Mon Apr 20 09:42:48 UTC 2026","passed","Mon Apr 20 09:42:49 UTC 2026","UI Error Handling Coverage","tests/error-handling.spec.ts","",""
"","41","Server Unit Tests GET /api/colors returns all seeded colors with correct names and hex values","","Mon Apr 20 09:39:52 UTC 2026","passed","Mon Apr 20 09:39:52 UTC 2026","","Server Unit Tests","Server Unit Tests GET /api/colors returns all seeded colors with correct names and hex values",""
"","0","Utility Functions hslToRgb hue=330 (rose) → [255,0,128]","","Mon Apr 20 09:40:07 UTC 2026","passed","Mon Apr 20 09:40:07 UTC 2026","","Utility Functions","Utility Functions hslToRgb hue=330 (rose) → [255,0,128]",""
"","1","Utility Functions rgbToHsl white [255,255,255] → h=0, s=0, l=1","","Mon Apr 20 09:40:07 UTC 2026","passed","Mon Apr 20 09:40:07 UTC 2026","","Utility Functions","Utility Functions rgbToHsl white [255,255,255] → h=0, s=0, l=1",""
"","0","Utility Functions paintWheelPixel paints red at right edge (dx=r, dy=0, hue=0)","","Mon Apr 20 09:40:07 UTC 2026","passed","Mon Apr 20 09:40:07 UTC 2026","","Utility Functions","Utility Functions paintWheelPixel paints red at right edge (dx=r, dy=0, hue=0)",""
"","1330","should display all core elements and handle button interaction","Chrome","Mon Apr 20 09:44:43 UTC 2026","passed","Mon Apr 20 09:44:44 UTC 2026","Responsive Design – tablet (768×1024)","","",""
"","4","Server Unit Tests 405 Method Not Allowed sets the Allow header on /api/colors/:name with correct methods","","Mon Apr 20 09:39:52 UTC 2026","passed","Mon Apr 20 09:39:52 UTC 2026","","Server Unit Tests","Server Unit Tests 405 Method Not Allowed sets the Allow header on /api/colors/:name with correct methods",""
"","9","Server Unit Tests GET /api/colors/:name returns Turquoise color correctly","","Mon Apr 20 09:39:52 UTC 2026","passed","Mon Apr 20 09:39:52 UTC 2026","","Server Unit Tests","Server Unit Tests GET /api/colors/:name returns Turquoise color correctly",""
"","41","Frontend Unit Tests App Component add color 501 also triggers server error message (>= 500)","","Mon Apr 20 09:40:07 UTC 2026","passed","Mon Apr 20 09:40:07 UTC 2026","","Frontend Unit Tests","Frontend Unit Tests App Component add color 501 also triggers server error message (>= 500)",""
"","15","Component Tests ConfirmDialog cancel button calls onCancel","","Mon Apr 20 09:40:07 UTC 2026","passed","Mon Apr 20 09:40:07 UTC 2026","","Component Tests","Component Tests ConfirmDialog cancel button calls onCancel",""
"","1","Utility Functions rgbToHex output is lowercase","","Mon Apr 20 09:40:07 UTC 2026","passed","Mon Apr 20 09:40:07 UTC 2026","","Utility Functions","Utility Functions rgbToHex output is lowercase",""
"","7","Server Unit Tests Surviving Mutants & Edge Cases Allowed Methods kills mutants in allowedMethods object","","Mon Apr 20 09:39:52 UTC 2026","passed","Mon Apr 20 09:39:52 UTC 2026","","Server Unit Tests","Server Unit Tests Surviving Mutants & Edge Cases Allowed Methods kills mutants in allowedMethods object",""
"","13","Component Tests ColorPicker typing an invalid hex shows ""Use format #RRGGBB"" error","","Mon Apr 20 09:40:07 UTC 2026","passed","Mon Apr 20 09:40:07 UTC 2026","","Utility Functions","Component Tests ColorPicker typing an invalid hex shows ""Use format #RRGGBB"" error",""
"","1505","successfully adds a new color and shows its chip","Chrome","Mon Apr 20 09:42:39 UTC 2026","passed","Mon Apr 20 09:42:40 UTC 2026","Color Management — Add & Delete","tests/color-management.spec.ts","",""
"","5","Component Tests ConfirmDialog clicking the card itself does NOT call onCancel","","Mon Apr 20 09:40:07 UTC 2026","passed","Mon Apr 20 09:40:07 UTC 2026","","Component Tests","Component Tests ConfirmDialog clicking the card itself does NOT call onCancel",""
"","319","Server Unit Tests Surviving Mutants & Edge Cases Infrastructure uses MONGO_URI from environment if available","","Mon Apr 20 09:39:52 UTC 2026","passed","Mon Apr 20 09:39:52 UTC 2026","","Server Unit Tests","Server Unit Tests Surviving Mutants & Edge Cases Infrastructure uses MONGO_URI from environment if available",""
"","9","Frontend Unit Tests App Component shows error alert when initial fetch fails","","Mon Apr 20 09:40:07 UTC 2026","passed","Mon Apr 20 09:40:07 UTC 2026","","Frontend Unit Tests","Frontend Unit Tests App Component shows error alert when initial fetch fails",""
"","4","Server Unit Tests OpenAPI endpoints has exact application/json content-type","","Mon Apr 20 09:39:52 UTC 2026","passed","Mon Apr 20 09:39:52 UTC 2026","","Server Unit Tests","Server Unit Tests OpenAPI endpoints has exact application/json content-type",""
"","650","Example #2","BDD","Mon Apr 20 09:42:52 UTC 2026","passed","Mon Apr 20 09:42:52 UTC 2026","Language Switching > Switch language and verify translated UI labels","","",""
"","1401","color names rendered in the UI do not trigger script execution","Chrome","Mon Apr 20 09:42:45 UTC 2026","passed","Mon Apr 20 09:42:46 UTC 2026","Security > XSS Prevention","tests/security.spec.ts","",""
"","28","Component Tests ColorPicker lightness slider min value (0) gives black","","Mon Apr 20 09:40:07 UTC 2026","passed","Mon Apr 20 09:40:07 UTC 2026","","Utility Functions","Component Tests ColorPicker lightness slider min value (0) gives black",""
"","43","Frontend Unit Tests App Component add color 500 shows server error message","","Mon Apr 20 09:40:07 UTC 2026","passed","Mon Apr 20 09:40:07 UTC 2026","","Frontend Unit Tests","Frontend Unit Tests App Component add color 500 shows server error message",""
"","27","Component Tests ColorPicker duplicate check is case-insensitive","","Mon Apr 20 09:40:07 UTC 2026","passed","Mon Apr 20 09:40:07 UTC 2026","","Utility Functions","Component Tests ColorPicker duplicate check is case-insensitive",""
"","6","Server Unit Tests 405 Method Not Allowed does not return 405 for allowed PUT method on /api/colors/:name","","Mon Apr 20 09:39:52 UTC 2026","passed","Mon Apr 20 09:39:52 UTC 2026","","Server Unit Tests","Server Unit Tests 405 Method Not Allowed does not return 405 for allowed PUT method on /api/colors/:name",""
"","4","Server Unit Tests Middleware includes CORS headers","","Mon Apr 20 09:39:52 UTC 2026","passed","Mon Apr 20 09:39:52 UTC 2026","","Server Unit Tests","Server Unit Tests Middleware includes CORS headers",""
"","4","Component Tests ConfirmDialog Enter key calls onConfirm when not busy","","Mon Apr 20 09:40:07 UTC 2026","passed","Mon Apr 20 09:40:07 UTC 2026","","Component Tests","Component Tests ConfirmDialog Enter key calls onConfirm when not busy",""
"","4","Server Unit Tests OpenAPI endpoints serves the OpenAPI JSON spec with exact metadata","","Mon Apr 20 09:39:52 UTC 2026","passed","Mon Apr 20 09:39:52 UTC 2026","","Server Unit Tests","Server Unit Tests OpenAPI endpoints serves the OpenAPI JSON spec with exact metadata",""
"","5","Component Tests ConfirmDialog Escape key calls onCancel when not busy","","Mon Apr 20 09:40:07 UTC 2026","passed","Mon Apr 20 09:40:07 UTC 2026","","Component Tests","Component Tests ConfirmDialog Escape key calls onCancel when not busy",""
"","69","Frontend Unit Tests App Component fetches and displays color chips with swatch and delete button","","Mon Apr 20 09:40:07 UTC 2026","passed","Mon Apr 20 09:40:07 UTC 2026","","Frontend Unit Tests","Frontend Unit Tests App Component fetches and displays color chips with swatch and delete button",""
"","1","Frontend Unit Tests i18n Configuration should have defined resources for en, es, el","","Mon Apr 20 09:40:09 UTC 2026","passed","Mon Apr 20 09:40:09 UTC 2026","","Frontend Unit Tests","Frontend Unit Tests i18n Configuration should have defined resources for en, es, el",""
"","10","Component Tests ConfirmDialog swatch div has the correct background color","","Mon Apr 20 09:40:07 UTC 2026","passed","Mon Apr 20 09:40:07 UTC 2026","","Component Tests","Component Tests ConfirmDialog swatch div has the correct background color",""
"","0","Utility Functions readableOn returns #111 for light-grey (L≈0.60, above 0.179 threshold)","","Mon Apr 20 09:40:07 UTC 2026","passed","Mon Apr 20 09:40:07 UTC 2026","","Utility Functions","Utility Functions readableOn returns #111 for light-grey (L≈0.60, above 0.179 threshold)",""
"","12","Server Unit Tests Error Handling POST /api/colors returns 500 when database fails (create)","","Mon Apr 20 09:39:52 UTC 2026","passed","Mon Apr 20 09:39:52 UTC 2026","","Server Unit Tests","Server Unit Tests Error Handling POST /api/colors returns 500 when database fails (create)",""
"","63","Component Tests ColorPicker editing name does NOT call onClearError when no serverError","","Mon Apr 20 09:40:07 UTC 2026","passed","Mon Apr 20 09:40:07 UTC 2026","","Utility Functions","Component Tests ColorPicker editing name does NOT call onClearError when no serverError",""
"","5","Server Unit Tests Error Handling DELETE /api/colors/:name returns 500 when database fails","","Mon Apr 20 09:39:52 UTC 2026","passed","Mon Apr 20 09:39:52 UTC 2026","","Server Unit Tests","Server Unit Tests Error Handling DELETE /api/colors/:name returns 500 when database fails",""
"","606","Show loading state when the API returns an empty colors list","BDD","Mon Apr 20 09:42:47 UTC 2026","passed","Mon Apr 20 09:42:48 UTC 2026","API Error Handling","","",""
"","18","should reject invalid hex format on update","Chrome","Mon Apr 20 09:43:29 UTC 2026","passed","Mon Apr 20 09:43:29 UTC 2026","Backend API Integration > PUT /api/colors/:name Schema Validation","tests/api.spec.ts","",""
"","0","Utility Functions hslToRgb hue=120 (green) → [0,255,0]","","Mon Apr 20 09:40:07 UTC 2026","passed","Mon Apr 20 09:40:07 UTC 2026","","Utility Functions","Utility Functions hslToRgb hue=120 (green) → [0,255,0]",""
"","112","Component Tests ColorPicker renders the modal with title, hex preview, name and hex inputs","","Mon Apr 20 09:40:07 UTC 2026","passed","Mon Apr 20 09:40:07 UTC 2026","","Utility Functions","Component Tests ColorPicker renders the modal with title, hex preview, name and hex inputs",""
"","5","Server Integration Tests (Testcontainers) PUT /api/colors/:name should return 400 for invalid hex format on update","","Mon Apr 20 09:39:53 UTC 2026","passed","Mon Apr 20 09:39:53 UTC 2026","","Server Integration Tests (Testcontainers)","Server Integration Tests (Testcontainers) PUT /api/colors/:name should return 400 for invalid hex format on update",""
"","0","Utility Functions rgbToHsl round-trip hslToRgb→rgbToHsl preserves hue for all sectors","","Mon Apr 20 09:40:07 UTC 2026","passed","Mon Apr 20 09:40:07 UTC 2026","","Utility Functions","Utility Functions rgbToHsl round-trip hslToRgb→rgbToHsl preserves hue for all sectors",""
"","4","Server Unit Tests DELETE /api/colors/:name returns 404 for a non-existent color","","Mon Apr 20 09:39:52 UTC 2026","passed","Mon Apr 20 09:39:52 UTC 2026","","Server Unit Tests","Server Unit Tests DELETE /api/colors/:name returns 404 for a non-existent color",""
"","1427","homepage should match snapshot","Chrome","Mon Apr 20 09:44:41 UTC 2026","passed","Mon Apr 20 09:44:42 UTC 2026","Visual Regression – desktop-xl (1920×1080)","","",""
"","4","Server Unit Tests POST /api/colors returns 400 for name with only spaces","","Mon Apr 20 09:39:52 UTC 2026","passed","Mon Apr 20 09:39:52 UTC 2026","","Server Unit Tests","Server Unit Tests POST /api/colors returns 400 for name with only spaces",""
"","3","Server Unit Tests Surviving Mutants & Edge Cases Mongoose Schema Strictness kills empty schema mutant by checking schema paths","","Mon Apr 20 09:39:52 UTC 2026","passed","Mon Apr 20 09:39:52 UTC 2026","","Server Unit Tests","Server Unit Tests Surviving Mutants & Edge Cases Mongoose Schema Strictness kills empty schema mutant by checking schema paths",""
"","4","Server Unit Tests Surviving Mutants & Edge Cases Logs seedDatabase logs success message","","Mon Apr 20 09:39:52 UTC 2026","passed","Mon Apr 20 09:39:52 UTC 2026","","Server Unit Tests","Server Unit Tests Surviving Mutants & Edge Cases Logs seedDatabase logs success message",""
"","4","Server Unit Tests Surviving Mutants & Edge Cases Swagger Metadata & OpenAPI has exact server metadata","","Mon Apr 20 09:39:52 UTC 2026","passed","Mon Apr 20 09:39:52 UTC 2026","","Server Unit Tests","Server Unit Tests Surviving Mutants & Edge Cases Swagger Metadata & OpenAPI has exact server metadata",""
"","3","Frontend Unit Tests i18n Configuration should translate keys correctly","","Mon Apr 20 09:40:09 UTC 2026","passed","Mon Apr 20 09:40:09 UTC 2026","","Frontend Unit Tests","Frontend Unit Tests i18n Configuration should translate keys correctly",""
"","6","Server Unit Tests POST /api/colors accepts names with alphanumeric characters and spaces","","Mon Apr 20 09:39:52 UTC 2026","passed","Mon Apr 20 09:39:52 UTC 2026","","Server Unit Tests","Server Unit Tests POST /api/colors accepts names with alphanumeric characters and spaces",""
"","0","Utility Functions readableOn returns #fff for black (very dark, L≈0)","","Mon Apr 20 09:40:07 UTC 2026","passed","Mon Apr 20 09:40:07 UTC 2026","","Utility Functions","Utility Functions readableOn returns #fff for black (very dark, L≈0)",""
"","10","Server Unit Tests GET /api/colors does not expose _id or __v fields","","Mon Apr 20 09:39:52 UTC 2026","passed","Mon Apr 20 09:39:52 UTC 2026","","Server Unit Tests","Server Unit Tests GET /api/colors does not expose _id or __v fields",""
"","4","Server Unit Tests POST /api/colors returns 400 when hex is missing","","Mon Apr 20 09:39:52 UTC 2026","passed","Mon Apr 20 09:39:52 UTC 2026","","Server Unit Tests","Server Unit Tests POST /api/colors returns 400 when hex is missing",""
"","25","Server Integration Tests (Testcontainers) POST /api/colors should create a new color and persist it in the real database","","Mon Apr 20 09:39:53 UTC 2026","passed","Mon Apr 20 09:39:53 UTC 2026","","Server Integration Tests (Testcontainers)","Server Integration Tests (Testcontainers) POST /api/colors should create a new color and persist it in the real database",""
"","30","Component Tests ColorPicker submit with duplicate name (client-side) shows duplicate error","","Mon Apr 20 09:40:07 UTC 2026","passed","Mon Apr 20 09:40:07 UTC 2026","","Utility Functions","Component Tests ColorPicker submit with duplicate name (client-side) shows duplicate error",""
